title,url
"Transversal Centres of Excellence","https://ec.europa.eu/info/funding-tenders/opportunities/portal/screen/opportunities/topic-details/HORIZON-JU-EUROHPC-2026-COE-LH-01-02"
"Community Centres of Excellence","https://ec.europa.eu/info/funding-tenders/opportunities/portal/screen/opportunities/topic-details/HORIZON-JU-EUROHPC-2026-COE-LH-01-01"
"Post-exascale HPC (CSA)","https://ec.europa.eu/info/funding-tenders/opportunities/portal/screen/opportunities/topic-details/HORIZON-CL4-2025-03-DIGITAL-EMERGING-04"
"Strengthening the fabless Start-up and SME ecosystem in Europe (CSA)","https://ec.europa.eu/info/funding-tenders/opportunities/portal/screen/opportunities/topic-details/HORIZON-CL4-2025-03-DIGITAL-EMERGING-08"
"Robust and trustworthy GenerativeAI for Robotics and industrial automation (RIA) (AI/Data/Robotics & Made in Europe Partnerships)","https://ec.europa.eu/info/funding-tenders/opportunities/portal/screen/opportunities/topic-details/HORIZON-CL4-2025-03-DIGITAL-EMERGING-07"
"GenAI4EU: Generative AI for Virtual Worlds: Advanced technologies for better performance and hyper personalised and immersive experience (IA) (AI/Data/Robotics & Virtual Worlds Partnerships)","https://ec.europa.eu/info/funding-tenders/opportunities/portal/screen/opportunities/topic-details/HORIZON-CL4-2025-03-HUMAN-15"
"Preparing the Advancement of the state of the art of submarine cable infrastructures (CSA)","https://ec.europa.eu/info/funding-tenders/opportunities/portal/screen/opportunities/topic-details/HORIZON-CL4-2025-03-DATA-12"
"Alignment of stakeholders towards the supply-side large-scale pilot of end-to-end infrastructures integrating device, network computing and communication capabilities (CSA)","https://ec.europa.eu/info/funding-tenders/opportunities/portal/screen/opportunities/topic-details/HORIZON-CL4-2025-03-DATA-09"
"Challenge-Driven GenAI4EU Booster (RIA) (AI/Data/Robotics Partnership)","https://ec.europa.eu/info/funding-tenders/opportunities/portal/screen/opportunities/topic-details/HORIZON-CL4-2025-03-DIGITAL-EMERGING-09"
"GenAI4EU central Hub (CSA) (AI/Data/Robotics Partnership)","https://ec.europa.eu/info/funding-tenders/opportunities/portal/screen/opportunities/topic-details/HORIZON-CL4-2025-03-HUMAN-18"
"International cooperation in semiconductors (CSA)","https://ec.europa.eu/info/funding-tenders/opportunities/portal/screen/opportunities/topic-details/HORIZON-CL4-2025-03-HUMAN-19"
"Core technologies for virtual worlds (RIA) (Virtual Worlds and Photonics Partnerships)","https://ec.europa.eu/info/funding-tenders/opportunities/portal/screen/opportunities/topic-details/HORIZON-CL4-2025-03-HUMAN-14"
"Innovative Advanced Materials (IAMs) for conformable, flexible or stretchable electronics (RIA) (Innovative Advanced Materials for Europe partnership)","https://ec.europa.eu/info/funding-tenders/opportunities/portal/screen/opportunities/topic-details/HORIZON-CL4-2025-03-MATERIALS-47"
"Innovative Advanced Materials (IAMs) for photonics, enabling low-power and ultra-broadband performance for telecommunication (RIA) (Innovative Advanced Materials for Europe partnership)","https://ec.europa.eu/info/funding-tenders/opportunities/portal/screen/opportunities/topic-details/HORIZON-CL4-2025-03-MATERIALS-46"
"Large-scale pilots for supply end-to-end infrastructures integrating device, network computing and communication capabilities for Telco Edge Cloud deployments, as a basis for Connected Collaborative Computing Networks (3C networks) (RIA)","https://ec.europa.eu/info/funding-tenders/opportunities/portal/screen/opportunities/topic-details/HORIZON-CL4-2025-03-DATA-08"
"Quantum Computing – complementing the quantum computing FPAs with the development of a technology agnostic software stack (RIA)","https://ec.europa.eu/info/funding-tenders/opportunities/portal/screen/opportunities/topic-details/HORIZON-CL4-2025-03-DIGITAL-EMERGING-02"
"Continuation of the Quantum Technologies Flagship (CSA)","https://ec.europa.eu/info/funding-tenders/opportunities/portal/screen/opportunities/topic-details/HORIZON-CL4-2025-03-DIGITAL-EMERGING-01"
"Fostering Innovative and Compliant Data Ecosystems (IA) (AI, Data and Robotics Partnership)","https://ec.europa.eu/info/funding-tenders/opportunities/portal/screen/opportunities/topic-details/HORIZON-CL4-2025-03-DATA-13"
"Supporting Digital Partnerships in Quantum technologies (RIA)","https://ec.europa.eu/info/funding-tenders/opportunities/portal/screen/opportunities/topic-details/HORIZON-CL4-2025-03-DIGITAL-EMERGING-03"
"Roadmap for next generation computing technologies from IoT device level to edge to cloud to HPC (CSA)","https://ec.europa.eu/info/funding-tenders/opportunities/portal/screen/opportunities/topic-details/HORIZON-CL4-2025-03-DATA-10"
"Drive the evolution of the internet towards open and interoperable Web 4.0 and Virtual Worlds: building blocks in priority areas (RIA) (Virtual Worlds Partnership)","https://ec.europa.eu/info/funding-tenders/opportunities/portal/screen/opportunities/topic-details/HORIZON-CL4-2025-03-HUMAN-16"
"Specific support for the Virtual Worlds Partnership and the Web 4.0 initiative (CSA) (Virtual Worlds Partnership)","https://ec.europa.eu/info/funding-tenders/opportunities/portal/screen/opportunities/topic-details/HORIZON-CL4-2025-03-HUMAN-17"
"Open Internet Stack: development of technological commons/open-source 3C building blocks (RIA)","https://ec.europa.eu/info/funding-tenders/opportunities/portal/screen/opportunities/topic-details/HORIZON-CL4-2025-03-DATA-11"
"Advanced sensor technologies and multimodal sensor integration for multiple application domains (IA) (Photonics Partnership)","https://ec.europa.eu/info/funding-tenders/opportunities/portal/screen/opportunities/topic-details/HORIZON-CL4-2025-04-DIGITAL-EMERGING-01"
"Software Engineering for AI and generative AI (RIA) (AI/Data/Robotics Partnership)","https://ec.europa.eu/info/funding-tenders/opportunities/portal/screen/opportunities/topic-details/HORIZON-CL4-2025-04-DATA-03"
"Assessment methodologies for General Purpose AI capabilities and risks (RIA) (AI/Data/Robotics Partnership)","https://ec.europa.eu/info/funding-tenders/opportunities/portal/screen/opportunities/topic-details/HORIZON-CL4-2025-04-DIGITAL-EMERGING-04"
"GenAI for Africa","https://ec.europa.eu/info/funding-tenders/opportunities/portal/screen/opportunities/topic-details/HORIZON-CL4-2025-04-HUMAN-08"
"Empowering AI/generative AI along the Cognitive Computing continuum (RIA) (AI/Data/Robotics Partnership)","https://ec.europa.eu/info/funding-tenders/opportunities/portal/screen/opportunities/topic-details/HORIZON-CL4-2025-04-DATA-02"
"SOFT Innovation Prize 2026","https://ec.europa.eu/info/funding-tenders/opportunities/portal/screen/opportunities/topic-details/EURATOM-2026-SOFT-PRIZE"
"MSCA Doctoral Networks 2025","https://ec.europa.eu/info/funding-tenders/opportunities/portal/screen/opportunities/topic-details/HORIZON-MSCA-2025-DN-01-01"
"Interregional Innovation Investments Strand 2a","https://ec.europa.eu/info/funding-tenders/opportunities/portal/screen/opportunities/topic-details/I3-2025-INV2a"
"Innovative Advanced Materials (IAMs) for robust, fast curing sealants and coatings for manufacturing and final assembly (IA) (Innovative Advanced Materials for Europe partnership)","https://ec.europa.eu/info/funding-tenders/opportunities/portal/screen/opportunities/topic-details/HORIZON-CL4-2025-05-MATERIALS-43-two-stage"
"Innovative Advanced Materials (IAMs) for product monitoring, smart maintenance and repair strategies in the construction sector (RIA) (Innovative Advanced Materials for Europe partnership)","https://ec.europa.eu/info/funding-tenders/opportunities/portal/screen/opportunities/topic-details/HORIZON-CL4-2025-05-MATERIALS-42-two-stage"
"Development of safe and sustainable by design alternatives to Perfluoroalkyl and Polyfluoroalkyl Substances (PFAS) (IA)","https://ec.europa.eu/info/funding-tenders/opportunities/portal/screen/opportunities/topic-details/HORIZON-CL4-2025-05-MATERIALS-51-two-stage"
"Developing and embedding upcycling technologies into viable business (Processes4Planet partnership) (IA)","https://ec.europa.eu/info/funding-tenders/opportunities/portal/screen/opportunities/topic-details/HORIZON-CL4-2025-05-TWIN-TRANSITION-35-two-stage"
"Demonstrators for clusters of social circular enterprises (IA)","https://ec.europa.eu/info/funding-tenders/opportunities/portal/screen/opportunities/topic-details/HORIZON-CL4-2025-05-TWIN-TRANSITION-21-two-stage"
"Enhanced logistics and operations of construction sites (IA)","https://ec.europa.eu/info/funding-tenders/opportunities/portal/screen/opportunities/topic-details/HORIZON-CL4-2025-05-TWIN-TRANSITION-11-two-stage"
"Improving the quality of life of persons with intellectual disabilities and their families","https://ec.europa.eu/info/funding-tenders/opportunities/portal/screen/opportunities/topic-details/HORIZON-HLTH-2025-03-STAYHLTH-01-two-stage"
"Interregional Innovation Investments Strand 1","https://ec.europa.eu/info/funding-tenders/opportunities/portal/screen/opportunities/topic-details/I3-2025-INV1"
"Facilitating the conduct of multinational clinical studies of orphan devices and/or of highly innovative (“breakthrough”) devices","https://ec.europa.eu/info/funding-tenders/opportunities/portal/screen/opportunities/topic-details/HORIZON-HLTH-2025-03-IND-03-two-stage"
"The impact of pollution on the development and progression of brain diseases and disorders","https://ec.europa.eu/info/funding-tenders/opportunities/portal/screen/opportunities/topic-details/HORIZON-HLTH-2025-03-ENVHLTH-01-two-stage"
"Advancing innovative interventions for mental, behavioural and neurodevelopmental disorders","https://ec.europa.eu/info/funding-tenders/opportunities/portal/screen/opportunities/topic-details/HORIZON-HLTH-2025-03-DISEASE-02-two-stage"
"Advancing knowledge on the impacts of micro- and nanoplastics on human health","https://ec.europa.eu/info/funding-tenders/opportunities/portal/screen/opportunities/topic-details/HORIZON-HLTH-2025-03-ENVHLTH-02-two-stage"
"Gender differences in career trajectories of parents and their implications for gender equality and family well-being","https://ec.europa.eu/info/funding-tenders/opportunities/portal/screen/opportunities/topic-details/HORIZON-CL2-2025-02-TRANSFO-04-two-stage"
"Innovative approaches to intangible cultural heritage for societal resilience","https://ec.europa.eu/info/funding-tenders/opportunities/portal/screen/opportunities/topic-details/HORIZON-CL2-2025-02-HERITAGE-02-two-stage"
"Co-funded European partnership for Resilient Cultural Heritage","https://ec.europa.eu/info/funding-tenders/opportunities/portal/screen/opportunities/topic-details/HORIZON-CL2-2025-03-HERITAGE-01"
"Implementing co-funded action plans for connected regional innovation valleys in widening countries","https://ec.europa.eu/info/funding-tenders/opportunities/portal/screen/opportunities/topic-details/HORIZON-WIDERA-2025-05-ACCESS-01"
"Preparatory action for setting up joint programmes among innovation ecosystems actors","https://ec.europa.eu/info/funding-tenders/opportunities/portal/screen/opportunities/topic-details/HORIZON-EIE-2025-02-CONNECT-01"
"Implementing co-funded action plans for connected regional innovation valleys","https://ec.europa.eu/info/funding-tenders/opportunities/portal/screen/opportunities/topic-details/HORIZON-EIE-2025-02-CONNECT-02"
"Game-changing innovations for European launch solutions","https://ec.europa.eu/info/funding-tenders/opportunities/portal/screen/opportunities/topic-details/PPPA-2025-LAUNCHERS-INNOVATIONS"
"European Excellence Initiative (EEI)","https://ec.europa.eu/info/funding-tenders/opportunities/portal/screen/opportunities/topic-details/HORIZON-WIDERA-2025-01-ACCESS-01"
"Open Topic: Innovative solutions for the sustainable and circular transformation of SMEs","https://ec.europa.eu/info/funding-tenders/opportunities/portal/screen/opportunities/topic-details/HORIZON-CL6-2025-01-CIRCBIO-01-two-stage"
"Broadening the living labs approach for soil health in Africa and Latin America and the Caribbean (LAC)","https://ec.europa.eu/info/funding-tenders/opportunities/portal/screen/opportunities/topic-details/HORIZON-MISS-2025-05-SOIL-02-two-stage"
"Living labs to enhance soil health in Continental, Boreal and Alpine biogeographical regions","https://ec.europa.eu/info/funding-tenders/opportunities/portal/screen/opportunities/topic-details/HORIZON-MISS-2025-05-SOIL-01-two-stage"
"Living labs co-creating innovative solutions for forests and freshwater ecosystems restoration","https://ec.europa.eu/info/funding-tenders/opportunities/portal/screen/opportunities/topic-details/HORIZON-CL6-2025-01-BIODIV-01-two-stage"
"Selection of partners to carry out EUROPE DIRECT activities","https://ec.europa.eu/info/funding-tenders/opportunities/portal/screen/opportunities/topic-details/ED-2025-PORTUGAL-FPA"
"Adaptation to Climate Change: Effectiveness and Limits","https://ec.europa.eu/info/funding-tenders/opportunities/portal/screen/opportunities/topic-details/HORIZON-CL5-2025-05-Two-Stage-D1-05"
"Strengthening the resilience of water systems and water sector to climate and global socio-economic change impacts","https://ec.europa.eu/info/funding-tenders/opportunities/portal/screen/opportunities/topic-details/HORIZON-CL6-2025-02-CLIMATE-01-two-stage"
"Substances of concern and emerging pollutants from bio-based industries and products: mapping and replacement","https://ec.europa.eu/info/funding-tenders/opportunities/portal/screen/opportunities/topic-details/HORIZON-CL6-2025-01-ZEROPOLLUTION-01-two-stage"
"Next generation aircraft autonomy technologies for cockpit / pilot assistance applications","https://ec.europa.eu/info/funding-tenders/opportunities/portal/screen/opportunities/topic-details/HORIZON-CL5-2025-03-Two-Stage-D5-09"
"Breeding for resilience: enhancing multi-stress tolerance in crops","https://ec.europa.eu/info/funding-tenders/opportunities/portal/screen/opportunities/topic-details/HORIZON-CL6-2025-01-BIODIV-02-two-stage"
"Emerging and future risks to plant health","https://ec.europa.eu/info/funding-tenders/opportunities/portal/screen/opportunities/topic-details/HORIZON-CL6-2025-02-FARM2FORK-01-two-stage"
"Open topic: Innovating for on-farm post-harvest operations, storage and transformation of crops into food and non-food products","https://ec.europa.eu/info/funding-tenders/opportunities/portal/screen/opportunities/topic-details/HORIZON-CL6-2025-02-FARM2FORK-02-two-stage"
"Network of neighbourhoods for innovative policies on gentrification","https://ec.europa.eu/info/funding-tenders/opportunities/portal/screen/opportunities/topic-details/HORIZON-NEB-2025-01-PARTICIPATION-04"
"The impact of common space on neighbourhood communities","https://ec.europa.eu/info/funding-tenders/opportunities/portal/screen/opportunities/topic-details/HORIZON-NEB-2025-01-PARTICIPATION-01"
"Applying regenerative design to the built environment in neighbourhoods","https://ec.europa.eu/info/funding-tenders/opportunities/portal/screen/opportunities/topic-details/HORIZON-NEB-2025-01-REGEN-01"
"Beautiful, sustainable and inclusive street furniture for the transformation of neighbourhoods","https://ec.europa.eu/info/funding-tenders/opportunities/portal/screen/opportunities/topic-details/HORIZON-NEB-2025-01-PARTICIPATION-03"
"Making food systems more resilient to food safety risks through the deployment of technological solutions","https://ec.europa.eu/info/funding-tenders/opportunities/portal/screen/opportunities/topic-details/HORIZON-CL6-2025-02-FARM2FORK-03-two-stage"
"Research and innovation for food waste prevention and reduction at household level through measurement, monitoring and new technologies","https://ec.europa.eu/info/funding-tenders/opportunities/portal/screen/opportunities/topic-details/HORIZON-CL6-2025-02-FARM2FORK-04-two-stage"
"Developing agroecology living labs and lighthouses for climate action under the Food and Nutrition Security and Sustainable Agriculture (FNSSA) partnership","https://ec.europa.eu/info/funding-tenders/opportunities/portal/screen/opportunities/topic-details/HORIZON-CL6-2025-02-FARM2FORK-05-two-stage"
"Fostering and maintaining the social fabric for the green transition in neighbourhoods","https://ec.europa.eu/info/funding-tenders/opportunities/portal/screen/opportunities/topic-details/HORIZON-NEB-2025-01-PARTICIPATION-02"
"Bio-fabricated materials for sustainable and beautiful construction","https://ec.europa.eu/info/funding-tenders/opportunities/portal/screen/opportunities/topic-details/HORIZON-NEB-2025-01-REGEN-02"
"Innovative approaches for sustainable, inclusive and beautiful social and affordable housing","https://ec.europa.eu/info/funding-tenders/opportunities/portal/screen/opportunities/topic-details/HORIZON-NEB-2025-01-REGEN-04"
"Supporting regional and local authorities in developing their Action Plans towards climate resilience","https://ec.europa.eu/info/funding-tenders/opportunities/portal/screen/opportunities/topic-details/HORIZON-MISS-2025-01-CLIMA-02"
"Better understanding incentives for private sector financing of adaptation solutions","https://ec.europa.eu/info/funding-tenders/opportunities/portal/screen/opportunities/topic-details/HORIZON-MISS-2025-01-CLIMA-05"
"Supporting regions and local authorities in assessing climate risks","https://ec.europa.eu/info/funding-tenders/opportunities/portal/screen/opportunities/topic-details/HORIZON-MISS-2025-01-CLIMA-01"
"Testing and demonstrating innovative solutions to improve resilience to extreme heat, including addressing health impacts","https://ec.europa.eu/info/funding-tenders/opportunities/portal/screen/opportunities/topic-details/HORIZON-MISS-2025-01-CLIMA-04"
"Demonstrating solutions to help hotspots in coastal regions to adapt to climate change","https://ec.europa.eu/info/funding-tenders/opportunities/portal/screen/opportunities/topic-details/HORIZON-MISS-2025-01-CLIMA-03"
"Pre-commercial procurement of breakthrough solutions for climate proofing of public buildings","https://ec.europa.eu/info/funding-tenders/opportunities/portal/screen/opportunities/topic-details/HORIZON-MISS-2025-01-CLIMA-06"
"Sufficiency measures in the built environment","https://ec.europa.eu/info/funding-tenders/opportunities/portal/screen/opportunities/topic-details/HORIZON-NEB-2025-01-REGEN-03"
"Reverse local construction supply chains for the beautiful re-assembly of reclaimed construction products","https://ec.europa.eu/info/funding-tenders/opportunities/portal/screen/opportunities/topic-details/HORIZON-NEB-2025-01-BUSINESS-03"
"Renovating the built environment through design for adaptability and disassembly.","https://ec.europa.eu/info/funding-tenders/opportunities/portal/screen/opportunities/topic-details/HORIZON-NEB-2025-01-BUSINESS-01"
"Bottom-up social entrepreneurship for the co-creation of neighbourhoods in line with the New European Bauhaus","https://ec.europa.eu/info/funding-tenders/opportunities/portal/screen/opportunities/topic-details/HORIZON-NEB-2025-01-BUSINESS-02"
"Cost-effective next-generation batteries for long-duration stationary storage (Batt4EU Partnership)","https://ec.europa.eu/info/funding-tenders/opportunities/portal/screen/opportunities/topic-details/HORIZON-CL5-2025-01-Two-Stage-D2-02"
"Critical elements for energy security of grid and storage technologies","https://ec.europa.eu/info/funding-tenders/opportunities/portal/screen/opportunities/topic-details/HORIZON-CL5-2025-01-Two-Stage-D3-23"
"Boosting the transformation towards climate-neutral cities, the net-zero economy and open strategic autonomy through Pre-Commercial Procurement (PCP)","https://ec.europa.eu/info/funding-tenders/opportunities/portal/screen/opportunities/topic-details/HORIZON-MISS-2026-04-PCP-CIT-01"
"Call for proposals for action grants to support transnational projects in the fields of e-Justice, victims’ rights and procedural rights","https://ec.europa.eu/info/funding-tenders/opportunities/portal/screen/opportunities/topic-details/JUST-2025-JACC-EJUSTICE"
"Strategic Integrated Projects - Climate Action","https://ec.europa.eu/info/funding-tenders/opportunities/portal/screen/opportunities/topic-details/LIFE-2025-STRAT-CLIMA-SIP-two-stage"
"Strategic Nature Projects","https://ec.europa.eu/info/funding-tenders/opportunities/portal/screen/opportunities/topic-details/LIFE-2025-STRAT-NAT-SNAP-two-stage"
"Strategic Integrated Projects - Environment","https://ec.europa.eu/info/funding-tenders/opportunities/portal/screen/opportunities/topic-details/LIFE-2025-STRAT-ENV-SIP-two-stage"
"Sectoral digital skills academies: Digital Skills Academy in GenAI","https://ec.europa.eu/info/funding-tenders/opportunities/portal/screen/opportunities/topic-details/DIGITAL-2025-SKILLS-08-GENAI-ACADEMY-STEP"
"Sectoral digital skills academies: Quantum Skills Digital Academy","https://ec.europa.eu/info/funding-tenders/opportunities/portal/screen/opportunities/topic-details/DIGITAL-2025-SKILLS-08-QUANTUM-ACADEMY-STEP"
"Sectoral digital skills academies: Virtual Worlds Skills Academy","https://ec.europa.eu/info/funding-tenders/opportunities/portal/screen/opportunities/topic-details/DIGITAL-2025-SKILLS-08-VIRTUAL-WORLDS-ACADEMY-STEP"
"Data Spaces Support Centre","https://ec.europa.eu/info/funding-tenders/opportunities/portal/screen/opportunities/topic-details/DIGITAL-2025-AI-08-DS-SUPPORT"
"Support to the secretariat for the Alliance on Processors and Semiconductor Technologies","https://ec.europa.eu/info/funding-tenders/opportunities/portal/screen/opportunities/topic-details/DIGITAL-2025-AI-08-PROCESSOR"
"Digital solutions for regulatory compliance through data","https://ec.europa.eu/info/funding-tenders/opportunities/portal/screen/opportunities/topic-details/DIGITAL-2025-AI-08-COMPLIANCE"
"Multi-Country project in Agri-Food","https://ec.europa.eu/info/funding-tenders/opportunities/portal/screen/opportunities/topic-details/DIGITAL-2025-AI-08-AGRIFOOD"
"Apply AI: GenAI for the public administrations","https://ec.europa.eu/info/funding-tenders/opportunities/portal/screen/opportunities/topic-details/DIGITAL-2025-AI-08-SUPPLY-AI"
"MSCA Staff Exchanges 2025","https://ec.europa.eu/info/funding-tenders/opportunities/portal/screen/opportunities/topic-details/HORIZON-MSCA-2025-SE-01-01"
"Low power Edge AI Chips","https://ec.europa.eu/info/funding-tenders/opportunities/portal/screen/opportunities/topic-details/HORIZON-JU-CHIPS-2025-IA-LEAI-two-stage"
"Land collaborative combat including air-land","https://ec.europa.eu/info/funding-tenders/opportunities/portal/screen/opportunities/topic-details/EDF-2025-DA-GROUND-LCC-STEP"
"Future modular multifunctional land platforms and enabling technologies, including green technologies","https://ec.europa.eu/info/funding-tenders/opportunities/portal/screen/opportunities/topic-details/EDF-2025-DA-GROUND-FM2LP"
"Advanced underwater networks","https://ec.europa.eu/info/funding-tenders/opportunities/portal/screen/opportunities/topic-details/EDF-2025-DA-UWW-AUWN-STEP"
"Drone-based affordable mass munitions","https://ec.europa.eu/info/funding-tenders/opportunities/portal/screen/opportunities/topic-details/EDF-2025-DA-SI-GROUND-DAMM"
"On-orbit operations and services","https://ec.europa.eu/info/funding-tenders/opportunities/portal/screen/opportunities/topic-details/EDF-2025-DA-SI-SPACE-3OS"
"Risk, robustness and resilience for autonomous vehicles in military operations","https://ec.europa.eu/info/funding-tenders/opportunities/portal/screen/opportunities/topic-details/EDF-2025-LS-RA-SI-CYBER-3RAV-STEP"
"Chiplet for Defence Application","https://ec.europa.eu/info/funding-tenders/opportunities/portal/screen/opportunities/topic-details/EDF-2025-RA-MATCOMP-CDA-STEP"
"Improved cyber defence operations capabilities","https://ec.europa.eu/info/funding-tenders/opportunities/portal/screen/opportunities/topic-details/EDF-2025-DA-CYBER-CDOC-STEP"
"Technologies for optronic detectors","https://ec.europa.eu/info/funding-tenders/opportunities/portal/screen/opportunities/topic-details/EDF-2025-DA-SENS-IRD-STEP"
"Privacy-preserving human-AI dialogue systems – Organisation of a technological challenge","https://ec.europa.eu/info/funding-tenders/opportunities/portal/screen/opportunities/topic-details/EDF-2025-LS-RA-CHALLENGE-DIGIT-HAIDO"
"Aircraft propulsion and energy management systems","https://ec.europa.eu/info/funding-tenders/opportunities/portal/screen/opportunities/topic-details/EDF-2025-DA-ENERENV-APEM"
"Collaborative air combat","https://ec.europa.eu/info/funding-tenders/opportunities/portal/screen/opportunities/topic-details/EDF-2025-DA-AIR-CAC"
"Enhanced pilot environment","https://ec.europa.eu/info/funding-tenders/opportunities/portal/screen/opportunities/topic-details/EDF-2025-DA-AIR-EPE"
"Space-based ISR constellation","https://ec.europa.eu/info/funding-tenders/opportunities/portal/screen/opportunities/topic-details/EDF-2025-DA-SPACE-SBISR"
"Full-size demonstrators for next generation soldier systems","https://ec.europa.eu/info/funding-tenders/opportunities/portal/screen/opportunities/topic-details/EDF-2025-DA-PROTMOB-SS"
"Non-thematic development actions by SMEs","https://ec.europa.eu/info/funding-tenders/opportunities/portal/screen/opportunities/topic-details/EDF-2025-LS-DA-SME-NT"
"Technologies for counter-battery capabilities","https://ec.europa.eu/info/funding-tenders/opportunities/portal/screen/opportunities/topic-details/EDF-2025-RA-GROUND-CBC"
"Multi-Disciplinary design and Analysis Framework for Aerial Systems","https://ec.europa.eu/info/funding-tenders/opportunities/portal/screen/opportunities/topic-details/EDF-2025-RA-SIMTRAIN-DAFAS"
"Stand-off anti-submarine warfare engagement","https://ec.europa.eu/info/funding-tenders/opportunities/portal/screen/opportunities/topic-details/EDF-2025-RA-UWW-SOASW"
"Great-depth enabling technologies","https://ec.europa.eu/info/funding-tenders/opportunities/portal/screen/opportunities/topic-details/EDF-2025-LS-RA-DIS-GDET"
