title,url
"Space Data Economy","https://ec.europa.eu/info/funding-tenders/opportunities/portal/screen/opportunities/topic-details/HORIZON-EUSPA-2026-SPACE-02-51"
"Innovative space-based applications enhancing capabilities for a resilient Europe","https://ec.europa.eu/info/funding-tenders/opportunities/portal/screen/opportunities/topic-details/HORIZON-EUSPA-2026-SPACE-02-52"
"MSCA Choose Europe for Science 2025","https://ec.europa.eu/info/funding-tenders/opportunities/portal/screen/opportunities/topic-details/HORIZON-MSCA-2025-COFUND-02-01"
"Risk Assessment in Eastern Eu","https://ec.europa.eu/info/funding-tenders/opportunities/portal/screen/opportunities/topic-details/EUBA-EFSA-2025-BIOHAW-04-04-Lot4"
"Risk Assessments in Southern Eu","https://ec.europa.eu/info/funding-tenders/opportunities/portal/screen/opportunities/topic-details/EUBA-EFSA-2025-BIOHAW-04-02-Lot2"
"Risk Assessment in Western Eu","https://ec.europa.eu/info/funding-tenders/opportunities/portal/screen/opportunities/topic-details/EUBA-EFSA-2025-BIOHAW-04-03-Lot3"
"Risk Assessments in Northern Eu","https://ec.europa.eu/info/funding-tenders/opportunities/portal/screen/opportunities/topic-details/EUBA-EFSA-2025-BIOHAW-04-01-Lot1"
"Building a trustworthy social media sphere: countering disinformation on social media for young Europeans","https://ec.europa.eu/info/funding-tenders/opportunities/portal/screen/opportunities/topic-details/PPPA-2025-DISINFORMATION-YOUNG"
"European VOD networks and operators","https://ec.europa.eu/info/funding-tenders/opportunities/portal/screen/opportunities/topic-details/CREA-MEDIA-2026-VODNET"
"Markets and Networking","https://ec.europa.eu/info/funding-tenders/opportunities/portal/screen/opportunities/topic-details/CREA-MEDIA-2026-MARKETNET"
"European slate development","https://ec.europa.eu/info/funding-tenders/opportunities/portal/screen/opportunities/topic-details/CREA-MEDIA-2026-DEVSLATE"
"TV and online content Animation projects","https://ec.europa.eu/info/funding-tenders/opportunities/portal/screen/opportunities/topic-details/CREA-MEDIA-2026-TVONLINE-1"
"Video games and immersive content development","https://ec.europa.eu/info/funding-tenders/opportunities/portal/screen/opportunities/topic-details/CREA-MEDIA-2026-DEVVGIM"
"European co-development","https://ec.europa.eu/info/funding-tenders/opportunities/portal/screen/opportunities/topic-details/CREA-MEDIA-2026-CODEV"
"TV and online content Documentary projects","https://ec.europa.eu/info/funding-tenders/opportunities/portal/screen/opportunities/topic-details/CREA-MEDIA-2026-TVONLINE-2"
"TV and online content Fiction projects","https://ec.europa.eu/info/funding-tenders/opportunities/portal/screen/opportunities/topic-details/CREA-MEDIA-2026-TVONLINE-3"
"Innovative tools and business models","https://ec.europa.eu/info/funding-tenders/opportunities/portal/screen/opportunities/topic-details/CREA-MEDIA-2026-INNOVBUSMOD"
"Predicting and avoiding road crashes based on Artificial Intelligence (AI) and big data","https://ec.europa.eu/info/funding-tenders/opportunities/portal/screen/opportunities/topic-details/HORIZON-CL5-2026-01-D6-14"
"Next-generation environment perception for real world CCAM operations: Error-free and secure technologies to improve energy-efficiency, cost-effectiveness, and circularity (CCAM Partnership)","https://ec.europa.eu/info/funding-tenders/opportunities/portal/screen/opportunities/topic-details/HORIZON-CL5-2026-01-D6-03"
"Accelerating freight transport and logistics digital innovation","https://ec.europa.eu/info/funding-tenders/opportunities/portal/screen/opportunities/topic-details/HORIZON-CL5-2026-01-D6-08"
"Development of sustainable and design-to-cost batteries with (energy-)efficient manufacturing processes and based on advanced and safer materials (Batt4EU Partnership)","https://ec.europa.eu/info/funding-tenders/opportunities/portal/screen/opportunities/topic-details/HORIZON-CL5-2026-01-D2-01"
"Safety of Cyclists, Pedestrians and Users of Micromobility Devices","https://ec.europa.eu/info/funding-tenders/opportunities/portal/screen/opportunities/topic-details/HORIZON-CL5-2026-01-D6-13"
"Integration of human driving behaviour in the validation of CCAM systems (CCAM Partnership)","https://ec.europa.eu/info/funding-tenders/opportunities/portal/screen/opportunities/topic-details/HORIZON-CL5-2026-01-D6-04"
"Innovative construction and maintenance, with the use of new materials and techniques, for resilient and sustainable transport infrastructure","https://ec.europa.eu/info/funding-tenders/opportunities/portal/screen/opportunities/topic-details/HORIZON-CL5-2026-01-D6-07"
"Integrating inland waterway transport in smart shipping and multimodal logistics chains","https://ec.europa.eu/info/funding-tenders/opportunities/portal/screen/opportunities/topic-details/HORIZON-CL5-2026-01-D6-10"
"Federated CCAM data exchange platform (CCAM Partnership)","https://ec.europa.eu/info/funding-tenders/opportunities/portal/screen/opportunities/topic-details/HORIZON-CL5-2026-01-D6-06"
"Accelerated multi-physical and virtual testing for battery aging, reliability, and safety evaluation (Batt4EU Partnership)","https://ec.europa.eu/info/funding-tenders/opportunities/portal/screen/opportunities/topic-details/HORIZON-CL5-2026-01-D2-05"
"Real time monitoring of regulated and non-regulated emissions from all types of vessels and other port activities in order to enforce emission limits in waterfront cities","https://ec.europa.eu/info/funding-tenders/opportunities/portal/screen/opportunities/topic-details/HORIZON-CL5-2026-01-D5-17"
"Approaches, verification and training for Edge-AI building blocks for CCAM Systems (CCAM Partnership)","https://ec.europa.eu/info/funding-tenders/opportunities/portal/screen/opportunities/topic-details/HORIZON-CL5-2026-01-D6-05"
"Reliable data and practices to measure and calculate transport emissions in multimodal transport chains","https://ec.europa.eu/info/funding-tenders/opportunities/portal/screen/opportunities/topic-details/HORIZON-CL5-2026-01-D6-09"
"Icing in the context of sustainable aviation","https://ec.europa.eu/info/funding-tenders/opportunities/portal/screen/opportunities/topic-details/HORIZON-CL5-2026-01-D6-15"
"Monitoring and Evaluation of the Societal Readiness Pilot","https://ec.europa.eu/info/funding-tenders/opportunities/portal/screen/opportunities/topic-details/HORIZON-CL5-2026-01-D2-09"
"Integrating advanced materials, cell design and manufacturing development for high-performance batteries aimed at mobility (Batt4EU Partnership)","https://ec.europa.eu/info/funding-tenders/opportunities/portal/screen/opportunities/topic-details/HORIZON-CL5-2026-01-D2-04"
"ERC CONSOLIDATOR GRANTS","https://ec.europa.eu/info/funding-tenders/opportunities/portal/screen/opportunities/topic-details/ERC-2026-COG"
"Call for proposals to support the development of a medicine pricing, reimbursement and access tracker through the EURIPID database","https://ec.europa.eu/info/funding-tenders/opportunities/portal/screen/opportunities/topic-details/EU4H-2026-SANTE-PJ-06"
"Call for proposals to pilot and implement cancer screening programmes for gastric cancer","https://ec.europa.eu/info/funding-tenders/opportunities/portal/screen/opportunities/topic-details/EU4H-2026-SANTE-PJ-01"
"Call for proposals to pilot and implement cancer screening programmes for lung cancer","https://ec.europa.eu/info/funding-tenders/opportunities/portal/screen/opportunities/topic-details/EU4H-2026-SANTE-PJ-02"
"Call for proposals for health data for biotech innovation leveraging the European Health Data Space","https://ec.europa.eu/info/funding-tenders/opportunities/portal/screen/opportunities/topic-details/EU4H-2026-SANTE-PJ-08"
"Call for proposals to pilot and implement cancer screening programmes for prostate cancer","https://ec.europa.eu/info/funding-tenders/opportunities/portal/screen/opportunities/topic-details/EU4H-2026-SANTE-PJ-03"
"Call for proposals on lifelong prevention for a healthy life with focus on cardiovascular diseases","https://ec.europa.eu/info/funding-tenders/opportunities/portal/screen/opportunities/topic-details/EU4H-2026-SANTE-PJ-05"
"Call for proposals for a programme on orphan medical devices, in particular targeting paediatric patients","https://ec.europa.eu/info/funding-tenders/opportunities/portal/screen/opportunities/topic-details/EU4H-2026-SANTE-PJ-07"
"Understand and minimise the environmental impacts of offshore wind energy","https://ec.europa.eu/info/funding-tenders/opportunities/portal/screen/opportunities/topic-details/HORIZON-CL5-2026-02-D3-08"
"Innovative solutions for a generative AI-powered digital spine of the EU energy system","https://ec.europa.eu/info/funding-tenders/opportunities/portal/screen/opportunities/topic-details/HORIZON-CL5-2026-02-D3-19"
"Smarter buildings as part of the energy system for increased efficiency and flexibility – Societal Readiness Pilot","https://ec.europa.eu/info/funding-tenders/opportunities/portal/screen/opportunities/topic-details/HORIZON-CL5-2026-02-D4-02"
"Innovative tools and services to manage and empower energy communities","https://ec.europa.eu/info/funding-tenders/opportunities/portal/screen/opportunities/topic-details/HORIZON-CL5-2026-02-D3-20"
"Large-scale production of liquid advanced biofuels and renewable fuels of non-biological origin","https://ec.europa.eu/info/funding-tenders/opportunities/portal/screen/opportunities/topic-details/HORIZON-CL5-2026-02-D3-01"
"Competitiveness, energy security and integration aspects of advanced biofuels and renewable fuels of non-biological origin value chains","https://ec.europa.eu/info/funding-tenders/opportunities/portal/screen/opportunities/topic-details/HORIZON-CL5-2026-02-D3-02"
"Underground Thermal Energy Storage in dense urban areas","https://ec.europa.eu/info/funding-tenders/opportunities/portal/screen/opportunities/topic-details/HORIZON-CL5-2026-02-D3-22"
"Demonstration of thermal energy storage solutions for solar thermal plants and systems","https://ec.europa.eu/info/funding-tenders/opportunities/portal/screen/opportunities/topic-details/HORIZON-CL5-2026-02-D3-05"
"Next generation distribution substation for increasing the system resilience","https://ec.europa.eu/info/funding-tenders/opportunities/portal/screen/opportunities/topic-details/HORIZON-CL5-2026-02-D3-18"
"Phase out fossil fuel in energy intensive industries through the efficient integration of renewable energy sources","https://ec.europa.eu/info/funding-tenders/opportunities/portal/screen/opportunities/topic-details/HORIZON-CL5-2026-02-D4-06"
"Optimal combination of low embodied carbon construction products, technical building systems and circularity principles for climate neutral buildings (Built4People Partnership)","https://ec.europa.eu/info/funding-tenders/opportunities/portal/screen/opportunities/topic-details/HORIZON-CL5-2026-02-D4-05"
"Development of innovative solutions strengthening the security of renewable energy value chains","https://ec.europa.eu/info/funding-tenders/opportunities/portal/screen/opportunities/topic-details/HORIZON-CL5-2026-02-D3-14"
"Innovative pathways for low carbon and climate resilient building stock and built environment (Built4People Partnership)","https://ec.europa.eu/info/funding-tenders/opportunities/portal/screen/opportunities/topic-details/HORIZON-CL5-2026-02-D4-03"
"Improved reliability and optimised operations and maintenance for wind energy systems","https://ec.europa.eu/info/funding-tenders/opportunities/portal/screen/opportunities/topic-details/HORIZON-CL5-2026-02-D3-07"
"On-site innovative robotic and automated solutions and techniques for more sustainable and less disruptive building renovation and construction","https://ec.europa.eu/info/funding-tenders/opportunities/portal/screen/opportunities/topic-details/HORIZON-CL5-2026-02-D4-01"
"Extending the lifetime of crystalline silicon PV modules (EUPI-PV Partnership)","https://ec.europa.eu/info/funding-tenders/opportunities/portal/screen/opportunities/topic-details/HORIZON-CL5-2026-02-D3-12"
"De-risking wave energy technology development through transnational pre-commercial procurement of wave energy research and development","https://ec.europa.eu/info/funding-tenders/opportunities/portal/screen/opportunities/topic-details/HORIZON-CL5-2026-02-D3-13"
"Innovative approaches for the deployment of Positive Energy Districts","https://ec.europa.eu/info/funding-tenders/opportunities/portal/screen/opportunities/topic-details/HORIZON-CL5-2026-02-D4-04"
"New CO2 capture technologies","https://ec.europa.eu/info/funding-tenders/opportunities/portal/screen/opportunities/topic-details/HORIZON-CL5-2026-02-D3-24"
"Towards commercialisation of Perovskite PV and development of dedicated manufacturing equipment (EUPI-PV Partnership)","https://ec.europa.eu/info/funding-tenders/opportunities/portal/screen/opportunities/topic-details/HORIZON-CL5-2026-02-D3-10"
"European network of national competence centers for innovation procurement","https://ec.europa.eu/info/funding-tenders/opportunities/portal/screen/opportunities/topic-details/HORIZON-EIE-2026-01-CONNECT-01"
"Expanding Investment Ecosystems","https://ec.europa.eu/info/funding-tenders/opportunities/portal/screen/opportunities/topic-details/HORIZON-EIE-2026-01-CONNECT-02"
"Scaling up deep tech ecosystems","https://ec.europa.eu/info/funding-tenders/opportunities/portal/screen/opportunities/topic-details/HORIZON-EIE-2026-01-CONNECT-03"
"Call for proposals to support the development of innovative medical countermeasures for chemical, biological, radiological and nuclear threats (HERA) - Medicinal products","https://ec.europa.eu/info/funding-tenders/opportunities/portal/screen/opportunities/topic-details/EU4H-2025-HERA-PJ-1-a"
"Call for proposals to support the development of innovative medical countermeasures for chemical, biological, radiological and nuclear threats (HERA) - Detection and diagnosis","https://ec.europa.eu/info/funding-tenders/opportunities/portal/screen/opportunities/topic-details/EU4H-2025-HERA-PJ-1-c"
"Call for proposals for the development of new diagnostic tests for vector-borne diseases (HERA)","https://ec.europa.eu/info/funding-tenders/opportunities/portal/screen/opportunities/topic-details/EU4H-2025-HERA-PJ-2"
"Call for proposals to support the development of innovative medical countermeasures for chemical, biological, radiological and nuclear threats (HERA) - Reusable respiratory personal protective equipment (PPE)","https://ec.europa.eu/info/funding-tenders/opportunities/portal/screen/opportunities/topic-details/EU4H-2025-HERA-PJ-1-b"
"The promotion of handicraft products and support of craftsmen","https://ec.europa.eu/info/funding-tenders/opportunities/portal/screen/opportunities/topic-details/PPPA-MOVE-2025-P032404"
"Empowering Truck Drivers – Revolutionizing European Logistics","https://ec.europa.eu/info/funding-tenders/opportunities/portal/screen/opportunities/topic-details/PPPA-2025-EMPOWERTD"
"Setting up of Cross-Border Coordination Points","https://ec.europa.eu/info/funding-tenders/opportunities/portal/screen/opportunities/topic-details/PPPA-2025-BRIDGEFOREU"
"Support for the Ukrainian tech SMEs and startups","https://ec.europa.eu/info/funding-tenders/opportunities/portal/screen/opportunities/topic-details/HORIZON-EIC-2025-UKRAINIANTECH-01"
"Networking and coordination of national HPC Competence Centres","https://ec.europa.eu/info/funding-tenders/opportunities/portal/screen/opportunities/topic-details/DIGITAL-JU-EUROHPC-2025-NCC-01-02"
"National Competence Centres for High Performance Computing","https://ec.europa.eu/info/funding-tenders/opportunities/portal/screen/opportunities/topic-details/DIGITAL-JU-EUROHPC-2025-NCC-01-01"
"Waste-to-value devices - circular production of renewable fuels, chemicals and materials","https://ec.europa.eu/info/funding-tenders/opportunities/portal/screen/opportunities/topic-details/HORIZON-EIC-2025-PATHFINDERCHALLENGES-01-04"
"Towards autonomous robot collectives delivering collaborative tasks in dynamic unstructured construction environments","https://ec.europa.eu/info/funding-tenders/opportunities/portal/screen/opportunities/topic-details/HORIZON-EIC-2025-PATHFINDERCHALLENGES-01-03"
"Generative-AI based Agents to Revolutionize Medical Diagnosis and Treatment of Cancer","https://ec.europa.eu/info/funding-tenders/opportunities/portal/screen/opportunities/topic-details/HORIZON-EIC-2025-PATHFINDERCHALLENGES-01-02"
"Biotech for Climate Resilient Crops and Plant-Based Biomanufacturing","https://ec.europa.eu/info/funding-tenders/opportunities/portal/screen/opportunities/topic-details/HORIZON-EIC-2025-PATHFINDERCHALLENGES-01-01"
"Promoting diversity management and inclusion at the workplace, both in the public and private sector","https://ec.europa.eu/info/funding-tenders/opportunities/portal/screen/opportunities/topic-details/CERV-2025-EQUAL-DIVERSITYMGT"
"Fighting against antisemitism","https://ec.europa.eu/info/funding-tenders/opportunities/portal/screen/opportunities/topic-details/CERV-2025-EQUAL-ANTISEMITISM"
"Fighting discrimination against LGBTIQ people and promoting LGBTIQ equality","https://ec.europa.eu/info/funding-tenders/opportunities/portal/screen/opportunities/topic-details/CERV-2025-EQUAL-LGBTIQ"
"Fighting against discrimination and racism, xenophobia and other forms of intolerance, including antigypsyism, anti-black, and anti-Asian racism","https://ec.europa.eu/info/funding-tenders/opportunities/portal/screen/opportunities/topic-details/CERV-2025-EQUAL-RACI-DISC"
"Fighting against anti-Muslim hatred","https://ec.europa.eu/info/funding-tenders/opportunities/portal/screen/opportunities/topic-details/CERV-2025-EQUAL-ANTIMUSLIM"
"Support to public authorities to combat racism, xenophobia, LGBTIQ-phobia and all other forms of intolerance, including intersectional discrimination","https://ec.europa.eu/info/funding-tenders/opportunities/portal/screen/opportunities/topic-details/CERV-2025-EQUAL-RESTRICTED"
"Support standardisation for the EuroQCI (CSA)","https://ec.europa.eu/info/funding-tenders/opportunities/portal/screen/opportunities/topic-details/DIGITAL-IRIS2-2025-QCI-03"
"Coordinate deployment for the EuroQCI (CSA)","https://ec.europa.eu/info/funding-tenders/opportunities/portal/screen/opportunities/topic-details/DIGITAL-IRIS2-2025-QCI-02"
"Maturing of a European industrial ecosystem for security-certified terrestrial QKD technologies and systems","https://ec.europa.eu/info/funding-tenders/opportunities/portal/screen/opportunities/topic-details/DIGITAL-IRIS2-2025-QCI-01"
"ERC SYNERGY GRANTS","https://ec.europa.eu/info/funding-tenders/opportunities/portal/screen/opportunities/topic-details/ERC-2026-SyG"
"ERC STARTING GRANTS","https://ec.europa.eu/info/funding-tenders/opportunities/portal/screen/opportunities/topic-details/ERC-2026-STG"
"Lot1: Improved methods for chemical and biological monitoring data collection and reporting in collaboration with AGoD and EFSA programs","https://ec.europa.eu/info/funding-tenders/opportunities/portal/screen/opportunities/topic-details/EUBA-EFSA-2025-IDATA-01-01-Lot1"
"Lot2: Harmonized food consumption and food composition data collection - Support to terminology management","https://ec.europa.eu/info/funding-tenders/opportunities/portal/screen/opportunities/topic-details/EUBA-EFSA-2025-IDATA-01-02-Lot2"
"DIGITAL-JU-CHIPS-2025-SG-SSOI","https://ec.europa.eu/info/funding-tenders/opportunities/portal/screen/opportunities/topic-details/DIGITAL-JU-CHIPS-2025-SG-SSOI"
"Support to the International HPC Summer School","https://ec.europa.eu/info/funding-tenders/opportunities/portal/screen/opportunities/topic-details/HORIZON-EUROHPC-JU-2025-IHPCSS-02"
"Operational digital platforms – Works","https://ec.europa.eu/info/funding-tenders/opportunities/portal/screen/opportunities/topic-details/CEF-DIG-2025-PLATFORMS-WORKS"
"European Researchers' Night and Researchers at Schools 2026-2027","https://ec.europa.eu/info/funding-tenders/opportunities/portal/screen/opportunities/topic-details/HORIZON-MSCA-2025-CITIZENS-01-01"
"Welfare monitoring: data driven risk assessment in fast and slower growing broilers (BROWARD)","https://ec.europa.eu/info/funding-tenders/opportunities/portal/screen/opportunities/topic-details/EUBA-EFSA-2025-BIOHAW-01"
"Establishing Ortho and Cardiology Ambulatory Surgical Centres in Europe","https://ec.europa.eu/info/funding-tenders/opportunities/portal/screen/opportunities/topic-details/HORIZON-JU-IHI-2025-11-05-two-stage"
"Understanding how infections foster and induce non-communicable diseases","https://ec.europa.eu/info/funding-tenders/opportunities/portal/screen/opportunities/topic-details/HORIZON-JU-IHI-2025-11-02-two-stage"
"Leveraging Europe's Expertise to accelerate Cell Therapy for Type 1 Diabetes","https://ec.europa.eu/info/funding-tenders/opportunities/portal/screen/opportunities/topic-details/HORIZON-JU-IHI-2025-11-04-two-stage"
"AI-Powered Signal Detection in Pharmacovigilance","https://ec.europa.eu/info/funding-tenders/opportunities/portal/screen/opportunities/topic-details/HORIZON-JU-IHI-2025-11-03-two-stage"
"Towards precision medicine: platform for transdiagnostic stratification of brain dysfunction","https://ec.europa.eu/info/funding-tenders/opportunities/portal/screen/opportunities/topic-details/HORIZON-JU-IHI-2025-11-01-two-stage"
"Integration of Post-Quantum Cryptography (PQC) algorithms into high-level protocols","https://ec.europa.eu/info/funding-tenders/opportunities/portal/screen/opportunities/topic-details/HORIZON-CL3-2025-02-CS-ECCC-06"
"Generative AI for Cybersecurity applications","https://ec.europa.eu/info/funding-tenders/opportunities/portal/screen/opportunities/topic-details/HORIZON-CL3-2025-02-CS-ECCC-01"
"Security evaluations of Post-Quantum Cryptography (PQC) primitives","https://ec.europa.eu/info/funding-tenders/opportunities/portal/screen/opportunities/topic-details/HORIZON-CL3-2025-02-CS-ECCC-04"
"Privacy Enhancing Technologies","https://ec.europa.eu/info/funding-tenders/opportunities/portal/screen/opportunities/topic-details/HORIZON-CL3-2025-02-CS-ECCC-03"
"Security of implementations of Post-Quantum Cryptography algorithms","https://ec.europa.eu/info/funding-tenders/opportunities/portal/screen/opportunities/topic-details/HORIZON-CL3-2025-02-CS-ECCC-05"
"Enhancing the NCC Network","https://ec.europa.eu/info/funding-tenders/opportunities/portal/screen/opportunities/topic-details/DIGITAL-ECCC-2025-DEPLOY-CYBER-08-NCC"
"Transition to post-quantum Public Key Infrastructures","https://ec.europa.eu/info/funding-tenders/opportunities/portal/screen/opportunities/topic-details/DIGITAL-ECCC-2025-DEPLOY-CYBER-08-PUBLICPQC"
"Dedicated action to reinforcing hospitals and healthcare providers","https://ec.europa.eu/info/funding-tenders/opportunities/portal/screen/opportunities/topic-details/DIGITAL-ECCC-2025-DEPLOY-CYBER-08-CYBERHEALTH"
"New advanced tools and processes for Operational Cybersecurity","https://ec.europa.eu/info/funding-tenders/opportunities/portal/screen/opportunities/topic-details/HORIZON-CL3-2025-02-CS-ECCC-02"
"EIC pre-accelerator - Widening","https://ec.europa.eu/info/funding-tenders/opportunities/portal/screen/opportunities/topic-details/HORIZON-WIDERA-2025-02-ACCESS-01"
"Open topic on testing / validating tools, technologies and data used in cross-border prevention, preparedness and responses to climate extreme and geological events and chemical, biological or radiological emergency threats","https://ec.europa.eu/info/funding-tenders/opportunities/portal/screen/opportunities/topic-details/HORIZON-CL3-2025-01-DRS-03"
"Humanitarian demining / Unexploded Ordnance Disposal (UXO) of civil areas and unexploded ordnance risk education","https://ec.europa.eu/info/funding-tenders/opportunities/portal/screen/opportunities/topic-details/HORIZON-CL3-2025-01-FCT-04"
"Open topic on secured and facilitated crossing of external borders","https://ec.europa.eu/info/funding-tenders/opportunities/portal/screen/opportunities/topic-details/HORIZON-CL3-2025-01-BM-02"
"Data repository for security research and innovation","https://ec.europa.eu/info/funding-tenders/opportunities/portal/screen/opportunities/topic-details/HORIZON-CL3-2025-01-SSRI-05"
"Open topic on improved intelligence picture and enhanced prevention, detection and deterrence of various forms of organised crime","https://ec.europa.eu/info/funding-tenders/opportunities/portal/screen/opportunities/topic-details/HORIZON-CL3-2025-01-FCT-03"
"Open topic on citizen and regional and/or local authorities' engagement in enhanced disaster risk awareness, including education, and preparedness","https://ec.europa.eu/info/funding-tenders/opportunities/portal/screen/opportunities/topic-details/HORIZON-CL3-2025-01-DRS-01"
"Open topic on Improving disaster risk management and governance to ensure self-sufficiency and sustainability of operations in support of enhanced resilience","https://ec.europa.eu/info/funding-tenders/opportunities/portal/screen/opportunities/topic-details/HORIZON-CL3-2025-01-DRS-02"
"Open topic on modern information and forensic evidence analysis and on frontline policing","https://ec.europa.eu/info/funding-tenders/opportunities/portal/screen/opportunities/topic-details/HORIZON-CL3-2025-01-FCT-01"
"Open grounds for pre-commercial procurement of innovative security technologies","https://ec.europa.eu/info/funding-tenders/opportunities/portal/screen/opportunities/topic-details/HORIZON-CL3-2025-01-SSRI-03"
"Open topic on prevention, detection and deterrence of various forms of crime and terrorism through an enhanced understanding of the related societal issues","https://ec.europa.eu/info/funding-tenders/opportunities/portal/screen/opportunities/topic-details/HORIZON-CL3-2025-01-FCT-02"
