title,url
"National Contact Points (NCPs) in the field of security and cybersecurity fostering the links with National Community building for Safe, Secure and Resilient Societies","https://ec.europa.eu/info/funding-tenders/opportunities/portal/screen/opportunities/topic-details/HORIZON-CL3-2025-01-SSRI-01"
"Lighthouse Codes for HPC Applications","https://ec.europa.eu/info/funding-tenders/opportunities/portal/screen/opportunities/topic-details/HORIZON-JU-EUROHPC-2026-COE-LH-01-03"
"Community Centres of Excellence","https://ec.europa.eu/info/funding-tenders/opportunities/portal/screen/opportunities/topic-details/HORIZON-JU-EUROHPC-2026-COE-LH-01-01"
"Transversal Centres of Excellence","https://ec.europa.eu/info/funding-tenders/opportunities/portal/screen/opportunities/topic-details/HORIZON-JU-EUROHPC-2026-COE-LH-01-02"
"SOFT Innovation Prize 2026","https://ec.europa.eu/info/funding-tenders/opportunities/portal/screen/opportunities/topic-details/EURATOM-2026-SOFT-PRIZE"
"MSCA Doctoral Networks 2025","https://ec.europa.eu/info/funding-tenders/opportunities/portal/screen/opportunities/topic-details/HORIZON-MSCA-2025-DN-01-01"
"Interregional Innovation Investments Strand 1","https://ec.europa.eu/info/funding-tenders/opportunities/portal/screen/opportunities/topic-details/I3-2025-INV1"
"Interregional Innovation Investments Strand 2a","https://ec.europa.eu/info/funding-tenders/opportunities/portal/screen/opportunities/topic-details/I3-2025-INV2a"
"Co-funded European partnership for Resilient Cultural Heritage","https://ec.europa.eu/info/funding-tenders/opportunities/portal/screen/opportunities/topic-details/HORIZON-CL2-2025-03-HERITAGE-01"
"Implementing co-funded action plans for connected regional innovation valleys in widening countries","https://ec.europa.eu/info/funding-tenders/opportunities/portal/screen/opportunities/topic-details/HORIZON-WIDERA-2025-05-ACCESS-01"
"Implementing co-funded action plans for connected regional innovation valleys","https://ec.europa.eu/info/funding-tenders/opportunities/portal/screen/opportunities/topic-details/HORIZON-EIE-2025-02-CONNECT-02"
"Preparatory action for setting up joint programmes among innovation ecosystems actors","https://ec.europa.eu/info/funding-tenders/opportunities/portal/screen/opportunities/topic-details/HORIZON-EIE-2025-02-CONNECT-01"
"Game-changing innovations for European launch solutions","https://ec.europa.eu/info/funding-tenders/opportunities/portal/screen/opportunities/topic-details/PPPA-2025-LAUNCHERS-INNOVATIONS"
"European Excellence Initiative (EEI)","https://ec.europa.eu/info/funding-tenders/opportunities/portal/screen/opportunities/topic-details/HORIZON-WIDERA-2025-01-ACCESS-01"
"Selection of partners to carry out EUROPE DIRECT activities","https://ec.europa.eu/info/funding-tenders/opportunities/portal/screen/opportunities/topic-details/ED-2025-PORTUGAL-FPA"
"Beautiful, sustainable and inclusive street furniture for the transformation of neighbourhoods","https://ec.europa.eu/info/funding-tenders/opportunities/portal/screen/opportunities/topic-details/HORIZON-NEB-2025-01-PARTICIPATION-03"
"Fostering and maintaining the social fabric for the green transition in neighbourhoods","https://ec.europa.eu/info/funding-tenders/opportunities/portal/screen/opportunities/topic-details/HORIZON-NEB-2025-01-PARTICIPATION-02"
"The impact of common space on neighbourhood communities","https://ec.europa.eu/info/funding-tenders/opportunities/portal/screen/opportunities/topic-details/HORIZON-NEB-2025-01-PARTICIPATION-01"
"Network of neighbourhoods for innovative policies on gentrification","https://ec.europa.eu/info/funding-tenders/opportunities/portal/screen/opportunities/topic-details/HORIZON-NEB-2025-01-PARTICIPATION-04"
"Bio-fabricated materials for sustainable and beautiful construction","https://ec.europa.eu/info/funding-tenders/opportunities/portal/screen/opportunities/topic-details/HORIZON-NEB-2025-01-REGEN-02"
"Reverse local construction supply chains for the beautiful re-assembly of reclaimed construction products","https://ec.europa.eu/info/funding-tenders/opportunities/portal/screen/opportunities/topic-details/HORIZON-NEB-2025-01-BUSINESS-03"
"Innovative approaches for sustainable, inclusive and beautiful social and affordable housing","https://ec.europa.eu/info/funding-tenders/opportunities/portal/screen/opportunities/topic-details/HORIZON-NEB-2025-01-REGEN-04"
"Renovating the built environment through design for adaptability and disassembly.","https://ec.europa.eu/info/funding-tenders/opportunities/portal/screen/opportunities/topic-details/HORIZON-NEB-2025-01-BUSINESS-01"
"Bottom-up social entrepreneurship for the co-creation of neighbourhoods in line with the New European Bauhaus","https://ec.europa.eu/info/funding-tenders/opportunities/portal/screen/opportunities/topic-details/HORIZON-NEB-2025-01-BUSINESS-02"
"Applying regenerative design to the built environment in neighbourhoods","https://ec.europa.eu/info/funding-tenders/opportunities/portal/screen/opportunities/topic-details/HORIZON-NEB-2025-01-REGEN-01"
"Sufficiency measures in the built environment","https://ec.europa.eu/info/funding-tenders/opportunities/portal/screen/opportunities/topic-details/HORIZON-NEB-2025-01-REGEN-03"
"Boosting the transformation towards climate-neutral cities, the net-zero economy and open strategic autonomy through Pre-Commercial Procurement (PCP)","https://ec.europa.eu/info/funding-tenders/opportunities/portal/screen/opportunities/topic-details/HORIZON-MISS-2026-04-PCP-CIT-01"
"Supporting regions and local authorities in assessing climate risks","https://ec.europa.eu/info/funding-tenders/opportunities/portal/screen/opportunities/topic-details/HORIZON-MISS-2025-01-CLIMA-01"
"Supporting regional and local authorities in developing their Action Plans towards climate resilience","https://ec.europa.eu/info/funding-tenders/opportunities/portal/screen/opportunities/topic-details/HORIZON-MISS-2025-01-CLIMA-02"
"Better understanding incentives for private sector financing of adaptation solutions","https://ec.europa.eu/info/funding-tenders/opportunities/portal/screen/opportunities/topic-details/HORIZON-MISS-2025-01-CLIMA-05"
"MSCA Staff Exchanges 2025","https://ec.europa.eu/info/funding-tenders/opportunities/portal/screen/opportunities/topic-details/HORIZON-MSCA-2025-SE-01-01"
"Low power Edge AI Chips","https://ec.europa.eu/info/funding-tenders/opportunities/portal/screen/opportunities/topic-details/HORIZON-JU-CHIPS-2025-IA-LEAI-two-stage"
"Land collaborative combat including air-land","https://ec.europa.eu/info/funding-tenders/opportunities/portal/screen/opportunities/topic-details/EDF-2025-DA-GROUND-LCC-STEP"
"Future modular multifunctional land platforms and enabling technologies, including green technologies","https://ec.europa.eu/info/funding-tenders/opportunities/portal/screen/opportunities/topic-details/EDF-2025-DA-GROUND-FM2LP"
"Advanced underwater networks","https://ec.europa.eu/info/funding-tenders/opportunities/portal/screen/opportunities/topic-details/EDF-2025-DA-UWW-AUWN-STEP"
"Drone-based affordable mass munitions","https://ec.europa.eu/info/funding-tenders/opportunities/portal/screen/opportunities/topic-details/EDF-2025-DA-SI-GROUND-DAMM"
"On-orbit operations and services","https://ec.europa.eu/info/funding-tenders/opportunities/portal/screen/opportunities/topic-details/EDF-2025-DA-SI-SPACE-3OS"
"Risk, robustness and resilience for autonomous vehicles in military operations","https://ec.europa.eu/info/funding-tenders/opportunities/portal/screen/opportunities/topic-details/EDF-2025-LS-RA-SI-CYBER-3RAV-STEP"
"Chiplet for Defence Application","https://ec.europa.eu/info/funding-tenders/opportunities/portal/screen/opportunities/topic-details/EDF-2025-RA-MATCOMP-CDA-STEP"
"Improved cyber defence operations capabilities","https://ec.europa.eu/info/funding-tenders/opportunities/portal/screen/opportunities/topic-details/EDF-2025-DA-CYBER-CDOC-STEP"
"Technologies for optronic detectors","https://ec.europa.eu/info/funding-tenders/opportunities/portal/screen/opportunities/topic-details/EDF-2025-DA-SENS-IRD-STEP"
"Privacy-preserving human-AI dialogue systems – Organisation of a technological challenge","https://ec.europa.eu/info/funding-tenders/opportunities/portal/screen/opportunities/topic-details/EDF-2025-LS-RA-CHALLENGE-DIGIT-HAIDO"
"Non-thematic research actions by SMEs and research organisations","https://ec.europa.eu/info/funding-tenders/opportunities/portal/screen/opportunities/topic-details/EDF-2025-LS-RA-SMERO-NT"
"Aircraft propulsion and energy management systems","https://ec.europa.eu/info/funding-tenders/opportunities/portal/screen/opportunities/topic-details/EDF-2025-DA-ENERENV-APEM"
"Space-based ISR constellation","https://ec.europa.eu/info/funding-tenders/opportunities/portal/screen/opportunities/topic-details/EDF-2025-DA-SPACE-SBISR"
"Full-size demonstrators for next generation soldier systems","https://ec.europa.eu/info/funding-tenders/opportunities/portal/screen/opportunities/topic-details/EDF-2025-DA-PROTMOB-SS"
"Non-thematic development actions by SMEs","https://ec.europa.eu/info/funding-tenders/opportunities/portal/screen/opportunities/topic-details/EDF-2025-LS-DA-SME-NT"
"Collaborative air combat","https://ec.europa.eu/info/funding-tenders/opportunities/portal/screen/opportunities/topic-details/EDF-2025-DA-AIR-CAC"
"Enhanced pilot environment","https://ec.europa.eu/info/funding-tenders/opportunities/portal/screen/opportunities/topic-details/EDF-2025-DA-AIR-EPE"
"Stand-off anti-submarine warfare engagement","https://ec.europa.eu/info/funding-tenders/opportunities/portal/screen/opportunities/topic-details/EDF-2025-RA-UWW-SOASW"
"Great-depth enabling technologies","https://ec.europa.eu/info/funding-tenders/opportunities/portal/screen/opportunities/topic-details/EDF-2025-LS-RA-DIS-GDET"
"Live, Virtual, Constructive training interoperability – Joint operations and service-specific solutions","https://ec.europa.eu/info/funding-tenders/opportunities/portal/screen/opportunities/topic-details/EDF-2025-RA-SIMTRAIN-LVC-STEP"
"Propulsion system for next generation rotorcrafts","https://ec.europa.eu/info/funding-tenders/opportunities/portal/screen/opportunities/topic-details/EDF-2025-RA-ENERENV-PSR"
"Digital Ship and Naval Combat Cloud","https://ec.europa.eu/info/funding-tenders/opportunities/portal/screen/opportunities/topic-details/EDF-2025-DA-NAVAL-DSNCC-STEP"
"Support to the EDF National Focal Points (NFP) network","https://ec.europa.eu/info/funding-tenders/opportunities/portal/screen/opportunities/topic-details/EDF-2025-CSA-NFP"
"Privacy-preserving human-AI dialogue systems – Participation in a technological challenge","https://ec.europa.eu/info/funding-tenders/opportunities/portal/screen/opportunities/topic-details/EDF-2025-LS-RA-CHALLENGE-DIGIT-HAIDP-STEP"
"EIC STEP Scale Up","https://ec.europa.eu/info/funding-tenders/opportunities/portal/screen/opportunities/topic-details/HORIZON-EIC-2025-EICSTEP-01"
"Support for the revision of the guidance document on terrestrial ecotoxicology (SANCO/10329/2002) including the development of an approach for indirect effects","https://ec.europa.eu/info/funding-tenders/opportunities/portal/screen/opportunities/topic-details/EUBA-2024-PLANTS-04"
"EIC Accelerator 2025 - Short application","https://ec.europa.eu/info/funding-tenders/opportunities/portal/screen/opportunities/topic-details/HORIZON-EIC-2025-ACCELERATOR-01"
"Alternative Fuels Infrastructure Facility - Co-funding Rate","https://ec.europa.eu/info/funding-tenders/opportunities/portal/screen/opportunities/topic-details/CEF-T-2024-AFIFCOEN-COSTS"
"Alternative Fuels Infrastructure Facility - Unit Contributions","https://ec.europa.eu/info/funding-tenders/opportunities/portal/screen/opportunities/topic-details/CEF-T-2024-AFIFGEN-UNITS"
"Alternative Fuels Infrastructure Facility - Unit Contributions","https://ec.europa.eu/info/funding-tenders/opportunities/portal/screen/opportunities/topic-details/CEF-T-2024-AFIFCOEN-UNITS"
"Alternative Fuels Infrastructure Facility - Co-funding Rate","https://ec.europa.eu/info/funding-tenders/opportunities/portal/screen/opportunities/topic-details/CEF-T-2024-AFIFGEN-COSTS"
"Erasmus Charter for Higher Education","https://ec.europa.eu/info/funding-tenders/opportunities/portal/screen/opportunities/topic-details/ERASMUS-EDU-2022-ECHE-CERT-FP"
"Quality Label Humanitarian Aid - Full Procedure","https://ec.europa.eu/info/funding-tenders/opportunities/portal/screen/opportunities/topic-details/ESC-HUMAID-2021-QUAL-LABEL-FP"