title,url
"Innovative space-based applications enhancing capabilities for a resilient Europe","https://ec.europa.eu/info/funding-tenders/opportunities/portal/screen/opportunities/topic-details/HORIZON-EUSPA-2026-SPACE-02-52"
"Space Data Economy","https://ec.europa.eu/info/funding-tenders/opportunities/portal/screen/opportunities/topic-details/HORIZON-EUSPA-2026-SPACE-02-51"
"MSCA Choose Europe for Science 2025","https://ec.europa.eu/info/funding-tenders/opportunities/portal/screen/opportunities/topic-details/HORIZON-MSCA-2025-COFUND-02-01"
"Building a trustworthy social media sphere: countering disinformation on social media for young Europeans","https://ec.europa.eu/info/funding-tenders/opportunities/portal/screen/opportunities/topic-details/PPPA-2025-DISINFORMATION-YOUNG"
"On-site innovative robotic and automated solutions and techniques for more sustainable and less disruptive building renovation and construction","https://ec.europa.eu/info/funding-tenders/opportunities/portal/screen/opportunities/topic-details/HORIZON-CL5-2026-02-D4-01"
"Next generation distribution substation for increasing the system resilience","https://ec.europa.eu/info/funding-tenders/opportunities/portal/screen/opportunities/topic-details/HORIZON-CL5-2026-02-D3-18"
"Innovative solutions for a generative AI-powered digital spine of the EU energy system","https://ec.europa.eu/info/funding-tenders/opportunities/portal/screen/opportunities/topic-details/HORIZON-CL5-2026-02-D3-19"
"Innovative tools and services to manage and empower energy communities","https://ec.europa.eu/info/funding-tenders/opportunities/portal/screen/opportunities/topic-details/HORIZON-CL5-2026-02-D3-20"
"De-risking wave energy technology development through transnational pre-commercial procurement of wave energy research and development","https://ec.europa.eu/info/funding-tenders/opportunities/portal/screen/opportunities/topic-details/HORIZON-CL5-2026-02-D3-13"
"Development of innovative solutions strengthening the security of renewable energy value chains","https://ec.europa.eu/info/funding-tenders/opportunities/portal/screen/opportunities/topic-details/HORIZON-CL5-2026-02-D3-14"
"New CO2 capture technologies","https://ec.europa.eu/info/funding-tenders/opportunities/portal/screen/opportunities/topic-details/HORIZON-CL5-2026-02-D3-24"
"Towards commercialisation of Perovskite PV and development of dedicated manufacturing equipment (EUPI-PV Partnership)","https://ec.europa.eu/info/funding-tenders/opportunities/portal/screen/opportunities/topic-details/HORIZON-CL5-2026-02-D3-10"
"Phase out fossil fuel in energy intensive industries through the efficient integration of renewable energy sources","https://ec.europa.eu/info/funding-tenders/opportunities/portal/screen/opportunities/topic-details/HORIZON-CL5-2026-02-D4-06"
"Optimal combination of low embodied carbon construction products, technical building systems and circularity principles for climate neutral buildings (Built4People Partnership)","https://ec.europa.eu/info/funding-tenders/opportunities/portal/screen/opportunities/topic-details/HORIZON-CL5-2026-02-D4-05"
"Innovative approaches for the deployment of Positive Energy Districts","https://ec.europa.eu/info/funding-tenders/opportunities/portal/screen/opportunities/topic-details/HORIZON-CL5-2026-02-D4-04"
"Demonstration of thermal energy storage solutions for solar thermal plants and systems","https://ec.europa.eu/info/funding-tenders/opportunities/portal/screen/opportunities/topic-details/HORIZON-CL5-2026-02-D3-05"
"Extending the lifetime of crystalline silicon PV modules (EUPI-PV Partnership)","https://ec.europa.eu/info/funding-tenders/opportunities/portal/screen/opportunities/topic-details/HORIZON-CL5-2026-02-D3-12"
"Understand and minimise the environmental impacts of offshore wind energy","https://ec.europa.eu/info/funding-tenders/opportunities/portal/screen/opportunities/topic-details/HORIZON-CL5-2026-02-D3-08"
"Underground Thermal Energy Storage in dense urban areas","https://ec.europa.eu/info/funding-tenders/opportunities/portal/screen/opportunities/topic-details/HORIZON-CL5-2026-02-D3-22"
"Competitiveness, energy security and integration aspects of advanced biofuels and renewable fuels of non-biological origin value chains","https://ec.europa.eu/info/funding-tenders/opportunities/portal/screen/opportunities/topic-details/HORIZON-CL5-2026-02-D3-02"
"Large-scale production of liquid advanced biofuels and renewable fuels of non-biological origin","https://ec.europa.eu/info/funding-tenders/opportunities/portal/screen/opportunities/topic-details/HORIZON-CL5-2026-02-D3-01"
"Smarter buildings as part of the energy system for increased efficiency and flexibility – Societal Readiness Pilot","https://ec.europa.eu/info/funding-tenders/opportunities/portal/screen/opportunities/topic-details/HORIZON-CL5-2026-02-D4-02"
"Innovative pathways for low carbon and climate resilient building stock and built environment (Built4People Partnership)","https://ec.europa.eu/info/funding-tenders/opportunities/portal/screen/opportunities/topic-details/HORIZON-CL5-2026-02-D4-03"
"Safety of Cyclists, Pedestrians and Users of Micromobility Devices","https://ec.europa.eu/info/funding-tenders/opportunities/portal/screen/opportunities/topic-details/HORIZON-CL5-2026-01-D6-13"
"Innovative construction and maintenance, with the use of new materials and techniques, for resilient and sustainable transport infrastructure","https://ec.europa.eu/info/funding-tenders/opportunities/portal/screen/opportunities/topic-details/HORIZON-CL5-2026-01-D6-07"
"Development of sustainable and design-to-cost batteries with (energy-)efficient manufacturing processes and based on advanced and safer materials (Batt4EU Partnership)","https://ec.europa.eu/info/funding-tenders/opportunities/portal/screen/opportunities/topic-details/HORIZON-CL5-2026-01-D2-01"
"Real time monitoring of regulated and non-regulated emissions from all types of vessels and other port activities in order to enforce emission limits in waterfront cities","https://ec.europa.eu/info/funding-tenders/opportunities/portal/screen/opportunities/topic-details/HORIZON-CL5-2026-01-D5-17"
"Approaches, verification and training for Edge-AI building blocks for CCAM Systems (CCAM Partnership)","https://ec.europa.eu/info/funding-tenders/opportunities/portal/screen/opportunities/topic-details/HORIZON-CL5-2026-01-D6-05"
"Accelerating freight transport and logistics digital innovation","https://ec.europa.eu/info/funding-tenders/opportunities/portal/screen/opportunities/topic-details/HORIZON-CL5-2026-01-D6-08"
"Integration of human driving behaviour in the validation of CCAM systems (CCAM Partnership)","https://ec.europa.eu/info/funding-tenders/opportunities/portal/screen/opportunities/topic-details/HORIZON-CL5-2026-01-D6-04"
"Integrating advanced materials, cell design and manufacturing development for high-performance batteries aimed at mobility (Batt4EU Partnership)","https://ec.europa.eu/info/funding-tenders/opportunities/portal/screen/opportunities/topic-details/HORIZON-CL5-2026-01-D2-04"
"Predicting and avoiding road crashes based on Artificial Intelligence (AI) and big data","https://ec.europa.eu/info/funding-tenders/opportunities/portal/screen/opportunities/topic-details/HORIZON-CL5-2026-01-D6-14"
"Monitoring and Evaluation of the Societal Readiness Pilot","https://ec.europa.eu/info/funding-tenders/opportunities/portal/screen/opportunities/topic-details/HORIZON-CL5-2026-01-D2-09"
"Integrating inland waterway transport in smart shipping and multimodal logistics chains","https://ec.europa.eu/info/funding-tenders/opportunities/portal/screen/opportunities/topic-details/HORIZON-CL5-2026-01-D6-10"
"Icing in the context of sustainable aviation","https://ec.europa.eu/info/funding-tenders/opportunities/portal/screen/opportunities/topic-details/HORIZON-CL5-2026-01-D6-15"
"Next-generation environment perception for real world CCAM operations: Error-free and secure technologies to improve energy-efficiency, cost-effectiveness, and circularity (CCAM Partnership)","https://ec.europa.eu/info/funding-tenders/opportunities/portal/screen/opportunities/topic-details/HORIZON-CL5-2026-01-D6-03"
"Reliable data and practices to measure and calculate transport emissions in multimodal transport chains","https://ec.europa.eu/info/funding-tenders/opportunities/portal/screen/opportunities/topic-details/HORIZON-CL5-2026-01-D6-09"
"Accelerated multi-physical and virtual testing for battery aging, reliability, and safety evaluation (Batt4EU Partnership)","https://ec.europa.eu/info/funding-tenders/opportunities/portal/screen/opportunities/topic-details/HORIZON-CL5-2026-01-D2-05"
"Federated CCAM data exchange platform (CCAM Partnership)","https://ec.europa.eu/info/funding-tenders/opportunities/portal/screen/opportunities/topic-details/HORIZON-CL5-2026-01-D6-06"
"Improved reliability and optimised operations and maintenance for wind energy systems","https://ec.europa.eu/info/funding-tenders/opportunities/portal/screen/opportunities/topic-details/HORIZON-CL5-2026-02-D3-07"
"Scaling up deep tech ecosystems","https://ec.europa.eu/info/funding-tenders/opportunities/portal/screen/opportunities/topic-details/HORIZON-EIE-2026-01-CONNECT-03"
"European network of national competence centers for innovation procurement","https://ec.europa.eu/info/funding-tenders/opportunities/portal/screen/opportunities/topic-details/HORIZON-EIE-2026-01-CONNECT-01"
"Call for proposals to support the development of innovative medical countermeasures for chemical, biological, radiological and nuclear threats (HERA) - Reusable respiratory personal protective equipment (PPE)","https://ec.europa.eu/info/funding-tenders/opportunities/portal/screen/opportunities/topic-details/EU4H-2025-HERA-PJ-1-b"
"Call for proposals for the development of new diagnostic tests for vector-borne diseases (HERA)","https://ec.europa.eu/info/funding-tenders/opportunities/portal/screen/opportunities/topic-details/EU4H-2025-HERA-PJ-2"
"Call for proposals to support the development of innovative medical countermeasures for chemical, biological, radiological and nuclear threats (HERA) - Detection and diagnosis","https://ec.europa.eu/info/funding-tenders/opportunities/portal/screen/opportunities/topic-details/EU4H-2025-HERA-PJ-1-c"
"Call for proposals to support the development of innovative medical countermeasures for chemical, biological, radiological and nuclear threats (HERA) - Medicinal products","https://ec.europa.eu/info/funding-tenders/opportunities/portal/screen/opportunities/topic-details/EU4H-2025-HERA-PJ-1-a"
"The promotion of handicraft products and support of craftsmen","https://ec.europa.eu/info/funding-tenders/opportunities/portal/screen/opportunities/topic-details/PPPA-MOVE-2025-P032404"
"Empowering Truck Drivers – Revolutionizing European Logistics","https://ec.europa.eu/info/funding-tenders/opportunities/portal/screen/opportunities/topic-details/PPPA-2025-EMPOWERTD"
"Setting up of Cross-Border Coordination Points","https://ec.europa.eu/info/funding-tenders/opportunities/portal/screen/opportunities/topic-details/PPPA-2025-BRIDGEFOREU"
"Support for the Ukrainian tech SMEs and startups","https://ec.europa.eu/info/funding-tenders/opportunities/portal/screen/opportunities/topic-details/HORIZON-EIC-2025-UKRAINIANTECH-01"