title,url
"Live, Virtual, Constructive training interoperability – Joint operations and service-specific solutions","https://ec.europa.eu/info/funding-tenders/opportunities/portal/screen/opportunities/topic-details/EDF-2025-RA-SIMTRAIN-LVC-STEP"
"Autonomous triage and evacuation","https://ec.europa.eu/info/funding-tenders/opportunities/portal/screen/opportunities/topic-details/EDF-2025-RA-MCBRN-ATE"
"Naval hybrid propulsion and power systems","https://ec.europa.eu/info/funding-tenders/opportunities/portal/screen/opportunities/topic-details/EDF-2025-LS-RA-SI-ENERENV-NH2PS-STEP"
"Multifunctional Information Distribution System","https://ec.europa.eu/info/funding-tenders/opportunities/portal/screen/opportunities/topic-details/EDF-2025-RA-C4ISR-MIDS-STEP"
"Propulsion system for next generation rotorcrafts","https://ec.europa.eu/info/funding-tenders/opportunities/portal/screen/opportunities/topic-details/EDF-2025-RA-ENERENV-PSR"
"Digital Ship and Naval Combat Cloud","https://ec.europa.eu/info/funding-tenders/opportunities/portal/screen/opportunities/topic-details/EDF-2025-DA-NAVAL-DSNCC-STEP"
"Non-thematic research actions targeting disruptive technologies for defence","https://ec.europa.eu/info/funding-tenders/opportunities/portal/screen/opportunities/topic-details/EDF-2025-LS-RA-DIS-NT"
"Multiband 4D Radar","https://ec.europa.eu/info/funding-tenders/opportunities/portal/screen/opportunities/topic-details/EDF-2025-DA-SENS-MB4DR-STEP"
"Non-thematic research actions by SMEs and research organisations","https://ec.europa.eu/info/funding-tenders/opportunities/portal/screen/opportunities/topic-details/EDF-2025-LS-RA-SMERO-NT"
"Privacy-preserving human-AI dialogue systems – Participation in a technological challenge","https://ec.europa.eu/info/funding-tenders/opportunities/portal/screen/opportunities/topic-details/EDF-2025-LS-RA-CHALLENGE-DIGIT-HAIDP-STEP"
"Support to the EDF National Focal Points (NFP) network","https://ec.europa.eu/info/funding-tenders/opportunities/portal/screen/opportunities/topic-details/EDF-2025-CSA-NFP"
"Digital label: one source of comprehensive information for medical technology products","https://ec.europa.eu/info/funding-tenders/opportunities/portal/screen/opportunities/topic-details/HORIZON-JU-IHI-2025-10-01-two-stage"
"Per- and Poly-fluoroalkyl substance (PFAS) exposure, emissions, and end of life management in the healthcare sector","https://ec.europa.eu/info/funding-tenders/opportunities/portal/screen/opportunities/topic-details/HORIZON-JU-IHI-2025-10-03-two-stage"
"Safeguarding innovation in secondary use of health data in the European Health Data Space (EHDS)","https://ec.europa.eu/info/funding-tenders/opportunities/portal/screen/opportunities/topic-details/HORIZON-JU-IHI-2025-10-02-two-stage"
"Teaming for Excellence","https://ec.europa.eu/info/funding-tenders/opportunities/portal/screen/opportunities/topic-details/HORIZON-WIDERA-2025-ACCESS-01-01-two-stage"
"EIC STEP Scale Up","https://ec.europa.eu/info/funding-tenders/opportunities/portal/screen/opportunities/topic-details/HORIZON-EIC-2025-EICSTEP-01"
"Support for the revision of the guidance document on terrestrial ecotoxicology (SANCO/10329/2002) including the development of an approach for indirect effects","https://ec.europa.eu/info/funding-tenders/opportunities/portal/screen/opportunities/topic-details/EUBA-2024-PLANTS-04"
"EIC Accelerator 2025 - Short application","https://ec.europa.eu/info/funding-tenders/opportunities/portal/screen/opportunities/topic-details/HORIZON-EIC-2025-ACCELERATOR-01"
"Alternative Fuels Infrastructure Facility - Co-funding Rate","https://ec.europa.eu/info/funding-tenders/opportunities/portal/screen/opportunities/topic-details/CEF-T-2024-AFIFCOEN-COSTS"
"Alternative Fuels Infrastructure Facility - Unit Contributions","https://ec.europa.eu/info/funding-tenders/opportunities/portal/screen/opportunities/topic-details/CEF-T-2024-AFIFGEN-UNITS"
"Alternative Fuels Infrastructure Facility - Unit Contributions","https://ec.europa.eu/info/funding-tenders/opportunities/portal/screen/opportunities/topic-details/CEF-T-2024-AFIFCOEN-UNITS"
"Alternative Fuels Infrastructure Facility - Co-funding Rate","https://ec.europa.eu/info/funding-tenders/opportunities/portal/screen/opportunities/topic-details/CEF-T-2024-AFIFGEN-COSTS"
"Erasmus Charter for Higher Education","https://ec.europa.eu/info/funding-tenders/opportunities/portal/screen/opportunities/topic-details/ERASMUS-EDU-2022-ECHE-CERT-FP"
"Quality Label Humanitarian Aid - Full Procedure","https://ec.europa.eu/info/funding-tenders/opportunities/portal/screen/opportunities/topic-details/ESC-HUMAID-2021-QUAL-LABEL-FP"