title,url
"Integration of Post-Quantum Cryptography (PQC) algorithms into high-level protocols","https://ec.europa.eu/info/funding-tenders/opportunities/portal/screen/opportunities/topic-details/HORIZON-CL3-2025-02-CS-ECCC-06"
"Generative AI for Cybersecurity applications","https://ec.europa.eu/info/funding-tenders/opportunities/portal/screen/opportunities/topic-details/HORIZON-CL3-2025-02-CS-ECCC-01"
"Security evaluations of Post-Quantum Cryptography (PQC) primitives","https://ec.europa.eu/info/funding-tenders/opportunities/portal/screen/opportunities/topic-details/HORIZON-CL3-2025-02-CS-ECCC-04"
"Privacy Enhancing Technologies","https://ec.europa.eu/info/funding-tenders/opportunities/portal/screen/opportunities/topic-details/HORIZON-CL3-2025-02-CS-ECCC-03"
"Security of implementations of Post-Quantum Cryptography algorithms","https://ec.europa.eu/info/funding-tenders/opportunities/portal/screen/opportunities/topic-details/HORIZON-CL3-2025-02-CS-ECCC-05"
"New advanced tools and processes for Operational Cybersecurity","https://ec.europa.eu/info/funding-tenders/opportunities/portal/screen/opportunities/topic-details/HORIZON-CL3-2025-02-CS-ECCC-02"
"EIC pre-accelerator - Widening","https://ec.europa.eu/info/funding-tenders/opportunities/portal/screen/opportunities/topic-details/HORIZON-WIDERA-2025-02-ACCESS-01"
"Open topic on testing / validating tools, technologies and data used in cross-border prevention, preparedness and responses to climate extreme and geological events and chemical, biological or radiological emergency threats","https://ec.europa.eu/info/funding-tenders/opportunities/portal/screen/opportunities/topic-details/HORIZON-CL3-2025-01-DRS-03"
"Accelerating uptake through open proposals for advanced SME innovation","https://ec.europa.eu/info/funding-tenders/opportunities/portal/screen/opportunities/topic-details/HORIZON-CL3-2025-01-SSRI-04"
"Open topic on efficient border surveillance and maritime security","https://ec.europa.eu/info/funding-tenders/opportunities/portal/screen/opportunities/topic-details/HORIZON-CL3-2025-01-BM-01"
"Open grounds for pre-commercial procurement of innovative security technologies","https://ec.europa.eu/info/funding-tenders/opportunities/portal/screen/opportunities/topic-details/HORIZON-CL3-2025-01-SSRI-03"
"Open topic on modern information and forensic evidence analysis and on frontline policing","https://ec.europa.eu/info/funding-tenders/opportunities/portal/screen/opportunities/topic-details/HORIZON-CL3-2025-01-FCT-01"
"Open topic for role of the human factor for the resilience of critical infrastructures","https://ec.europa.eu/info/funding-tenders/opportunities/portal/screen/opportunities/topic-details/HORIZON-CL3-2025-01-INFRA-02"
"Uptake Acceleration Services","https://ec.europa.eu/info/funding-tenders/opportunities/portal/screen/opportunities/topic-details/HORIZON-CL3-2025-01-SSRI-02"
"Open topic on prevention, detection and deterrence of various forms of crime and terrorism through an enhanced understanding of the related societal issues","https://ec.europa.eu/info/funding-tenders/opportunities/portal/screen/opportunities/topic-details/HORIZON-CL3-2025-01-FCT-02"
"Open topic on citizen and regional and/or local authorities' engagement in enhanced disaster risk awareness, including education, and preparedness","https://ec.europa.eu/info/funding-tenders/opportunities/portal/screen/opportunities/topic-details/HORIZON-CL3-2025-01-DRS-01"
"Open topic on improved intelligence picture and enhanced prevention, detection and deterrence of various forms of organised crime","https://ec.europa.eu/info/funding-tenders/opportunities/portal/screen/opportunities/topic-details/HORIZON-CL3-2025-01-FCT-03"
"Open topic for improved preparedness for, response to and recovery from large-scale disruptions of critical infrastructures","https://ec.europa.eu/info/funding-tenders/opportunities/portal/screen/opportunities/topic-details/HORIZON-CL3-2025-01-INFRA-01"
"Demand-led innovation for civil security through Pre-Commercial Procurement (PCP)","https://ec.europa.eu/info/funding-tenders/opportunities/portal/screen/opportunities/topic-details/HORIZON-CL3-2025-01-SSRI-06"
"Advancing autonomous systems and robotics for high-risk disaster response, strengthening disaster resilience in conflict-afflicted crisis zones","https://ec.europa.eu/info/funding-tenders/opportunities/portal/screen/opportunities/topic-details/HORIZON-CL3-2025-01-DRS-04"
"Open topic on Improving disaster risk management and governance to ensure self-sufficiency and sustainability of operations in support of enhanced resilience","https://ec.europa.eu/info/funding-tenders/opportunities/portal/screen/opportunities/topic-details/HORIZON-CL3-2025-01-DRS-02"
"Open topic on better customs and supply chain security","https://ec.europa.eu/info/funding-tenders/opportunities/portal/screen/opportunities/topic-details/HORIZON-CL3-2025-01-BM-03"
"Humanitarian demining / Unexploded Ordnance Disposal (UXO) of civil areas and unexploded ordnance risk education","https://ec.europa.eu/info/funding-tenders/opportunities/portal/screen/opportunities/topic-details/HORIZON-CL3-2025-01-FCT-04"
"Data repository for security research and innovation","https://ec.europa.eu/info/funding-tenders/opportunities/portal/screen/opportunities/topic-details/HORIZON-CL3-2025-01-SSRI-05"
"Lighthouse Codes for HPC Applications","https://ec.europa.eu/info/funding-tenders/opportunities/portal/screen/opportunities/topic-details/HORIZON-JU-EUROHPC-2026-COE-LH-01-03"
"Transversal Centres of Excellence","https://ec.europa.eu/info/funding-tenders/opportunities/portal/screen/opportunities/topic-details/HORIZON-JU-EUROHPC-2026-COE-LH-01-02"
"Community Centres of Excellence","https://ec.europa.eu/info/funding-tenders/opportunities/portal/screen/opportunities/topic-details/HORIZON-JU-EUROHPC-2026-COE-LH-01-01"
"SOFT Innovation Prize 2026","https://ec.europa.eu/info/funding-tenders/opportunities/portal/screen/opportunities/topic-details/EURATOM-2026-SOFT-PRIZE"
"MSCA Doctoral Networks 2025","https://ec.europa.eu/info/funding-tenders/opportunities/portal/screen/opportunities/topic-details/HORIZON-MSCA-2025-DN-01-01"
"Interregional Innovation Investments Strand 2a","https://ec.europa.eu/info/funding-tenders/opportunities/portal/screen/opportunities/topic-details/I3-2025-INV2a"
"Interregional Innovation Investments Strand 1","https://ec.europa.eu/info/funding-tenders/opportunities/portal/screen/opportunities/topic-details/I3-2025-INV1"
"Co-funded European partnership for Resilient Cultural Heritage","https://ec.europa.eu/info/funding-tenders/opportunities/portal/screen/opportunities/topic-details/HORIZON-CL2-2025-03-HERITAGE-01"
"Implementing co-funded action plans for connected regional innovation valleys in widening countries","https://ec.europa.eu/info/funding-tenders/opportunities/portal/screen/opportunities/topic-details/HORIZON-WIDERA-2025-05-ACCESS-01"
"Preparatory action for setting up joint programmes among innovation ecosystems actors","https://ec.europa.eu/info/funding-tenders/opportunities/portal/screen/opportunities/topic-details/HORIZON-EIE-2025-02-CONNECT-01"
"Implementing co-funded action plans for connected regional innovation valleys","https://ec.europa.eu/info/funding-tenders/opportunities/portal/screen/opportunities/topic-details/HORIZON-EIE-2025-02-CONNECT-02"
"European Excellence Initiative (EEI)","https://ec.europa.eu/info/funding-tenders/opportunities/portal/screen/opportunities/topic-details/HORIZON-WIDERA-2025-01-ACCESS-01"
"Selection of partners to carry out EUROPE DIRECT activities","https://ec.europa.eu/info/funding-tenders/opportunities/portal/screen/opportunities/topic-details/ED-2025-PORTUGAL-FPA"
"Fostering and maintaining the social fabric for the green transition in neighbourhoods","https://ec.europa.eu/info/funding-tenders/opportunities/portal/screen/opportunities/topic-details/HORIZON-NEB-2025-01-PARTICIPATION-02"
"The impact of common space on neighbourhood communities","https://ec.europa.eu/info/funding-tenders/opportunities/portal/screen/opportunities/topic-details/HORIZON-NEB-2025-01-PARTICIPATION-01"
"Network of neighbourhoods for innovative policies on gentrification","https://ec.europa.eu/info/funding-tenders/opportunities/portal/screen/opportunities/topic-details/HORIZON-NEB-2025-01-PARTICIPATION-04"
"Bio-fabricated materials for sustainable and beautiful construction","https://ec.europa.eu/info/funding-tenders/opportunities/portal/screen/opportunities/topic-details/HORIZON-NEB-2025-01-REGEN-02"
"Applying regenerative design to the built environment in neighbourhoods","https://ec.europa.eu/info/funding-tenders/opportunities/portal/screen/opportunities/topic-details/HORIZON-NEB-2025-01-REGEN-01"
"Beautiful, sustainable and inclusive street furniture for the transformation of neighbourhoods","https://ec.europa.eu/info/funding-tenders/opportunities/portal/screen/opportunities/topic-details/HORIZON-NEB-2025-01-PARTICIPATION-03"
"Boosting the transformation towards climate-neutral cities, the net-zero economy and open strategic autonomy through Pre-Commercial Procurement (PCP)","https://ec.europa.eu/info/funding-tenders/opportunities/portal/screen/opportunities/topic-details/HORIZON-MISS-2026-04-PCP-CIT-01"
"Sufficiency measures in the built environment","https://ec.europa.eu/info/funding-tenders/opportunities/portal/screen/opportunities/topic-details/HORIZON-NEB-2025-01-REGEN-03"
"Renovating the built environment through design for adaptability and disassembly.","https://ec.europa.eu/info/funding-tenders/opportunities/portal/screen/opportunities/topic-details/HORIZON-NEB-2025-01-BUSINESS-01"
"Bottom-up social entrepreneurship for the co-creation of neighbourhoods in line with the New European Bauhaus","https://ec.europa.eu/info/funding-tenders/opportunities/portal/screen/opportunities/topic-details/HORIZON-NEB-2025-01-BUSINESS-02"
"Reverse local construction supply chains for the beautiful re-assembly of reclaimed construction products","https://ec.europa.eu/info/funding-tenders/opportunities/portal/screen/opportunities/topic-details/HORIZON-NEB-2025-01-BUSINESS-03"
"Innovative approaches for sustainable, inclusive and beautiful social and affordable housing","https://ec.europa.eu/info/funding-tenders/opportunities/portal/screen/opportunities/topic-details/HORIZON-NEB-2025-01-REGEN-04"
"Testing and demonstrating innovative solutions to improve resilience to extreme heat, including addressing health impacts","https://ec.europa.eu/info/funding-tenders/opportunities/portal/screen/opportunities/topic-details/HORIZON-MISS-2025-01-CLIMA-04"
"Supporting regions and local authorities in assessing climate risks","https://ec.europa.eu/info/funding-tenders/opportunities/portal/screen/opportunities/topic-details/HORIZON-MISS-2025-01-CLIMA-01"
"Demonstrating solutions to help hotspots in coastal regions to adapt to climate change","https://ec.europa.eu/info/funding-tenders/opportunities/portal/screen/opportunities/topic-details/HORIZON-MISS-2025-01-CLIMA-03"
"Supporting regional and local authorities in developing their Action Plans towards climate resilience","https://ec.europa.eu/info/funding-tenders/opportunities/portal/screen/opportunities/topic-details/HORIZON-MISS-2025-01-CLIMA-02"
"Pre-commercial procurement of breakthrough solutions for climate proofing of public buildings","https://ec.europa.eu/info/funding-tenders/opportunities/portal/screen/opportunities/topic-details/HORIZON-MISS-2025-01-CLIMA-06"
"Better understanding incentives for private sector financing of adaptation solutions","https://ec.europa.eu/info/funding-tenders/opportunities/portal/screen/opportunities/topic-details/HORIZON-MISS-2025-01-CLIMA-05"
"Low power Edge AI Chips","https://ec.europa.eu/info/funding-tenders/opportunities/portal/screen/opportunities/topic-details/HORIZON-JU-CHIPS-2025-IA-LEAI-two-stage"
"Risk, robustness and resilience for autonomous vehicles in military operations","https://ec.europa.eu/info/funding-tenders/opportunities/portal/screen/opportunities/topic-details/EDF-2025-LS-RA-SI-CYBER-3RAV-STEP"
"Naval hybrid propulsion and power systems","https://ec.europa.eu/info/funding-tenders/opportunities/portal/screen/opportunities/topic-details/EDF-2025-LS-RA-SI-ENERENV-NH2PS-STEP"
"Non-thematic research actions targeting disruptive technologies for defence","https://ec.europa.eu/info/funding-tenders/opportunities/portal/screen/opportunities/topic-details/EDF-2025-LS-RA-DIS-NT"
"Technologies for optronic detectors","https://ec.europa.eu/info/funding-tenders/opportunities/portal/screen/opportunities/topic-details/EDF-2025-DA-SENS-IRD-STEP"
"Multiband 4D Radar","https://ec.europa.eu/info/funding-tenders/opportunities/portal/screen/opportunities/topic-details/EDF-2025-DA-SENS-MB4DR-STEP"
"Non-thematic research actions by SMEs and research organisations","https://ec.europa.eu/info/funding-tenders/opportunities/portal/screen/opportunities/topic-details/EDF-2025-LS-RA-SMERO-NT"
"Aircraft propulsion and energy management systems","https://ec.europa.eu/info/funding-tenders/opportunities/portal/screen/opportunities/topic-details/EDF-2025-DA-ENERENV-APEM"
"Space-based ISR constellation","https://ec.europa.eu/info/funding-tenders/opportunities/portal/screen/opportunities/topic-details/EDF-2025-DA-SPACE-SBISR"
"Full-size demonstrators for next generation soldier systems","https://ec.europa.eu/info/funding-tenders/opportunities/portal/screen/opportunities/topic-details/EDF-2025-DA-PROTMOB-SS"
"Drone-based affordable mass munitions","https://ec.europa.eu/info/funding-tenders/opportunities/portal/screen/opportunities/topic-details/EDF-2025-DA-SI-GROUND-DAMM"
"Non-thematic development actions by SMEs","https://ec.europa.eu/info/funding-tenders/opportunities/portal/screen/opportunities/topic-details/EDF-2025-LS-DA-SME-NT"
"Collaborative air combat","https://ec.europa.eu/info/funding-tenders/opportunities/portal/screen/opportunities/topic-details/EDF-2025-DA-AIR-CAC"
"Enhanced pilot environment","https://ec.europa.eu/info/funding-tenders/opportunities/portal/screen/opportunities/topic-details/EDF-2025-DA-AIR-EPE"
"Great-depth enabling technologies","https://ec.europa.eu/info/funding-tenders/opportunities/portal/screen/opportunities/topic-details/EDF-2025-LS-RA-DIS-GDET"
"Land collaborative combat including air-land","https://ec.europa.eu/info/funding-tenders/opportunities/portal/screen/opportunities/topic-details/EDF-2025-DA-GROUND-LCC-STEP"
"Future modular multifunctional land platforms and enabling technologies, including green technologies","https://ec.europa.eu/info/funding-tenders/opportunities/portal/screen/opportunities/topic-details/EDF-2025-DA-GROUND-FM2LP"
"Digital Ship and Naval Combat Cloud","https://ec.europa.eu/info/funding-tenders/opportunities/portal/screen/opportunities/topic-details/EDF-2025-DA-NAVAL-DSNCC-STEP"
"Advanced underwater networks","https://ec.europa.eu/info/funding-tenders/opportunities/portal/screen/opportunities/topic-details/EDF-2025-DA-UWW-AUWN-STEP"
"On-orbit operations and services","https://ec.europa.eu/info/funding-tenders/opportunities/portal/screen/opportunities/topic-details/EDF-2025-DA-SI-SPACE-3OS"
"Improved cyber defence operations capabilities","https://ec.europa.eu/info/funding-tenders/opportunities/portal/screen/opportunities/topic-details/EDF-2025-DA-CYBER-CDOC-STEP"
"Privacy-preserving human-AI dialogue systems – Organisation of a technological challenge","https://ec.europa.eu/info/funding-tenders/opportunities/portal/screen/opportunities/topic-details/EDF-2025-LS-RA-CHALLENGE-DIGIT-HAIDO"
"Support to the EDF National Focal Points (NFP) network","https://ec.europa.eu/info/funding-tenders/opportunities/portal/screen/opportunities/topic-details/EDF-2025-CSA-NFP"
"Privacy-preserving human-AI dialogue systems – Participation in a technological challenge","https://ec.europa.eu/info/funding-tenders/opportunities/portal/screen/opportunities/topic-details/EDF-2025-LS-RA-CHALLENGE-DIGIT-HAIDP-STEP"
"Live, Virtual, Constructive training interoperability – Joint operations and service-specific solutions","https://ec.europa.eu/info/funding-tenders/opportunities/portal/screen/opportunities/topic-details/EDF-2025-RA-SIMTRAIN-LVC-STEP"
"Propulsion system for next generation rotorcrafts","https://ec.europa.eu/info/funding-tenders/opportunities/portal/screen/opportunities/topic-details/EDF-2025-RA-ENERENV-PSR"
"Multifunctional Information Distribution System","https://ec.europa.eu/info/funding-tenders/opportunities/portal/screen/opportunities/topic-details/EDF-2025-RA-C4ISR-MIDS-STEP"
"Chiplet for Defence Application","https://ec.europa.eu/info/funding-tenders/opportunities/portal/screen/opportunities/topic-details/EDF-2025-RA-MATCOMP-CDA-STEP"
"Stand-off anti-submarine warfare engagement","https://ec.europa.eu/info/funding-tenders/opportunities/portal/screen/opportunities/topic-details/EDF-2025-RA-UWW-SOASW"
"Multi-Disciplinary design and Analysis Framework for Aerial Systems","https://ec.europa.eu/info/funding-tenders/opportunities/portal/screen/opportunities/topic-details/EDF-2025-RA-SIMTRAIN-DAFAS"
"Autonomous triage and evacuation","https://ec.europa.eu/info/funding-tenders/opportunities/portal/screen/opportunities/topic-details/EDF-2025-RA-MCBRN-ATE"
"Technologies for counter-battery capabilities","https://ec.europa.eu/info/funding-tenders/opportunities/portal/screen/opportunities/topic-details/EDF-2025-RA-GROUND-CBC"
"EIC STEP Scale Up","https://ec.europa.eu/info/funding-tenders/opportunities/portal/screen/opportunities/topic-details/HORIZON-EIC-2025-EICSTEP-01"
"Support for the revision of the guidance document on terrestrial ecotoxicology (SANCO/10329/2002) including the development of an approach for indirect effects","https://ec.europa.eu/info/funding-tenders/opportunities/portal/screen/opportunities/topic-details/EUBA-2024-PLANTS-04"
"EIC Accelerator 2025 - Short application","https://ec.europa.eu/info/funding-tenders/opportunities/portal/screen/opportunities/topic-details/HORIZON-EIC-2025-ACCELERATOR-01"
"Alternative Fuels Infrastructure Facility - Co-funding Rate","https://ec.europa.eu/info/funding-tenders/opportunities/portal/screen/opportunities/topic-details/CEF-T-2024-AFIFCOEN-COSTS"
"Alternative Fuels Infrastructure Facility - Unit Contributions","https://ec.europa.eu/info/funding-tenders/opportunities/portal/screen/opportunities/topic-details/CEF-T-2024-AFIFGEN-UNITS"
"Alternative Fuels Infrastructure Facility - Unit Contributions","https://ec.europa.eu/info/funding-tenders/opportunities/portal/screen/opportunities/topic-details/CEF-T-2024-AFIFCOEN-UNITS"
"Alternative Fuels Infrastructure Facility - Co-funding Rate","https://ec.europa.eu/info/funding-tenders/opportunities/portal/screen/opportunities/topic-details/CEF-T-2024-AFIFGEN-COSTS"
"Erasmus Charter for Higher Education","https://ec.europa.eu/info/funding-tenders/opportunities/portal/screen/opportunities/topic-details/ERASMUS-EDU-2022-ECHE-CERT-FP"
"Quality Label Humanitarian Aid - Full Procedure","https://ec.europa.eu/info/funding-tenders/opportunities/portal/screen/opportunities/topic-details/ESC-HUMAID-2021-QUAL-LABEL-FP"