title,url
"European Advanced Digital Skills Competitions","https://ec.europa.eu/info/funding-tenders/opportunities/portal/screen/opportunities/topic-details/DIGITAL-2026-SKILLS-09-COMPETITIONS"
"Data Space for Manufacturing","https://ec.europa.eu/info/funding-tenders/opportunities/portal/screen/opportunities/topic-details/DIGITAL-2026-DSM-AI-09-DS-MANUFACTUR-STEP"
"European Digital Media Observatory Hubs","https://ec.europa.eu/info/funding-tenders/opportunities/portal/screen/opportunities/topic-details/DIGITAL-2026-BESTUSE-TECH-EDMO-09-HUBS"
"Completion of the initial Network of European Digital Innovation Hubs","https://ec.europa.eu/info/funding-tenders/opportunities/portal/screen/opportunities/topic-details/DIGITAL-2026-EDIH-AC-09-COMPLETION-STEP"
"ELEVATE: European League of Advanced Digital Skills Academies","https://ec.europa.eu/info/funding-tenders/opportunities/portal/screen/opportunities/topic-details/DIGITAL-2026-SKILLS-09-LEAGUE-OF-ACADEMIES"
"Secretariat of the European Connected and Autonomous Vehicle Alliance","https://ec.europa.eu/info/funding-tenders/opportunities/portal/screen/opportunities/topic-details/DIGITAL-2026-AI-09-ECAVA"
"Apply AI: GenAI for the public administrations","https://ec.europa.eu/info/funding-tenders/opportunities/portal/screen/opportunities/topic-details/DIGITAL-2026-AI-09-GENAI-PA"
"Virtual worlds test beds","https://ec.europa.eu/info/funding-tenders/opportunities/portal/screen/opportunities/topic-details/DIGITAL-2026-AI-09-VIRTUAL-TESTBEDS-STEP"
"Health: Data ingestion capacities and data services for the European Genomic Data Infrastructure in the European Health Data Space: data tools","https://ec.europa.eu/info/funding-tenders/opportunities/portal/screen/opportunities/topic-details/DIGITAL-2026-AI-09-DS-HEALTH-TOOL"
"Health: Data ingestion capacities and data services for the European Genomic Data Infrastructure in the European Health Data Space: data storage and processing capacity","https://ec.europa.eu/info/funding-tenders/opportunities/portal/screen/opportunities/topic-details/DIGITAL-2026-AI-09-DS-HEALTH-STORAGE"
"Collaboration platform for the European connected and autonomous vehicle of the future","https://ec.europa.eu/info/funding-tenders/opportunities/portal/screen/opportunities/topic-details/DIGITAL-2026-AI-09-AUTOMOTIVE"
"Supporting the Network of National Contact Points (NCPs) of the Digital Europe Programme","https://ec.europa.eu/info/funding-tenders/opportunities/portal/screen/opportunities/topic-details/DIGITAL-2026-SUPPORT-09-NCP-NETWORK"
"Deployment of cutting-edge multi-modal AI-based solutions in medical imaging","https://ec.europa.eu/info/funding-tenders/opportunities/portal/screen/opportunities/topic-details/DIGITAL-2026-AI-09-SOLUTIONS-CANCER-STEP"
"Consolidation of the Network of European Digital Innovation Hubs (EDIHs with reinforced AI focus)","https://ec.europa.eu/info/funding-tenders/opportunities/portal/screen/opportunities/topic-details/DIGITAL-2026-EDIH-EU-EEA-09-CONSOLIDATION-STEP"
"NETWORK MANAGEMENT PLANNING AND CONTROL & MOBILITY MANAGEMENT IN A MULTIMODAL ENVIRONMENT AND DIGITAL ENABLERS","https://ec.europa.eu/info/funding-tenders/opportunities/portal/screen/opportunities/topic-details/HORIZON-JU-ER-2025-FA1-TT-01"
"EXTENDING THE RAIL NETWORK OF PHDS","https://ec.europa.eu/info/funding-tenders/opportunities/portal/screen/opportunities/topic-details/HORIZON-JU-ER-2025-EXPLR-03"
"SUPPORT TO THE EUROPEAN FRMCS DEPLOYMENT GROUP","https://ec.europa.eu/info/funding-tenders/opportunities/portal/screen/opportunities/topic-details/HORIZON-JU-ER-2025-EXPLR-04"
"INTELLIGENT & INTEGRATED ASSET MANAGEMENT","https://ec.europa.eu/info/funding-tenders/opportunities/portal/screen/opportunities/topic-details/HORIZON-JU-ER-2025-FA3-01"
"DIGITAL & AUTOMATIC UP TO AUTOMATED TRAIN OPERATIONS","https://ec.europa.eu/info/funding-tenders/opportunities/portal/screen/opportunities/topic-details/HORIZON-JU-ER-2025-FA2-01"
"REGIONAL RAIL SERVICES / INNOVATIVE RAIL SERVICES TO REVITALISE CAPILLARY LINES","https://ec.europa.eu/info/funding-tenders/opportunities/portal/screen/opportunities/topic-details/HORIZON-JU-ER-2025-FA6-01"
"SUSTAINABLE COMPETITIVE DIGITAL GREEN RAIL FREIGHT SERVICES","https://ec.europa.eu/info/funding-tenders/opportunities/portal/screen/opportunities/topic-details/HORIZON-JU-ER-2025-FA5-01"
"A SUSTAINABLE AND GREEN RAIL SYSTEM","https://ec.europa.eu/info/funding-tenders/opportunities/portal/screen/opportunities/topic-details/HORIZON-JU-ER-2025-FA4-01"
"STUDIES ON INNOVATION IN CLIMATE FINANCE FOR RAIL","https://ec.europa.eu/info/funding-tenders/opportunities/portal/screen/opportunities/topic-details/HORIZON-JU-ER-2025-EXPLR-02"
"STUDIES ON RAIL INDUSTRY 5.0","https://ec.europa.eu/info/funding-tenders/opportunities/portal/screen/opportunities/topic-details/HORIZON-JU-ER-2025-EXPLR-01"
"Space Data Economy","https://ec.europa.eu/info/funding-tenders/opportunities/portal/screen/opportunities/topic-details/HORIZON-EUSPA-2026-SPACE-02-51"
"Innovative space-based applications enhancing capabilities for a resilient Europe","https://ec.europa.eu/info/funding-tenders/opportunities/portal/screen/opportunities/topic-details/HORIZON-EUSPA-2026-SPACE-02-52"
"Support to the development and certification of EU Digital Identity Wallets","https://ec.europa.eu/info/funding-tenders/opportunities/portal/screen/opportunities/topic-details/DIGITAL-2025-BESTUSE-TECH-09-WALLET"
"Support the roll-out of EU Mobile Driving Licences","https://ec.europa.eu/info/funding-tenders/opportunities/portal/screen/opportunities/topic-details/DIGITAL-2025-BESTUSE-TECH-09-MDL"
"Support for information measures relating to the common agricultural policy (IMCAP)","https://ec.europa.eu/info/funding-tenders/opportunities/portal/screen/opportunities/topic-details/IMCAP-2026-INFOME"
"Risk Assessments in Northern Eu","https://ec.europa.eu/info/funding-tenders/opportunities/portal/screen/opportunities/topic-details/EUBA-EFSA-2025-BIOHAW-04-01-Lot1"
"MSCA Choose Europe for Science 2025","https://ec.europa.eu/info/funding-tenders/opportunities/portal/screen/opportunities/topic-details/HORIZON-MSCA-2025-COFUND-02-01"
"Risk Assessments in Southern Eu","https://ec.europa.eu/info/funding-tenders/opportunities/portal/screen/opportunities/topic-details/EUBA-EFSA-2025-BIOHAW-04-02-Lot2"
"Risk Assessment in Eastern Eu","https://ec.europa.eu/info/funding-tenders/opportunities/portal/screen/opportunities/topic-details/EUBA-EFSA-2025-BIOHAW-04-04-Lot4"
"Risk Assessment in Western Eu","https://ec.europa.eu/info/funding-tenders/opportunities/portal/screen/opportunities/topic-details/EUBA-EFSA-2025-BIOHAW-04-03-Lot3"
"Building a trustworthy social media sphere: countering disinformation on social media for young Europeans","https://ec.europa.eu/info/funding-tenders/opportunities/portal/screen/opportunities/topic-details/PPPA-2025-DISINFORMATION-YOUNG"
"European VOD networks and operators","https://ec.europa.eu/info/funding-tenders/opportunities/portal/screen/opportunities/topic-details/CREA-MEDIA-2026-VODNET"
"Markets and Networking","https://ec.europa.eu/info/funding-tenders/opportunities/portal/screen/opportunities/topic-details/CREA-MEDIA-2026-MARKETNET"
"Films on the Move","https://ec.europa.eu/info/funding-tenders/opportunities/portal/screen/opportunities/topic-details/CREA-MEDIA-2026-FILMOVE"
"Innovative tools and business models","https://ec.europa.eu/info/funding-tenders/opportunities/portal/screen/opportunities/topic-details/CREA-MEDIA-2026-INNOVBUSMOD"
"TV and online content Animation projects","https://ec.europa.eu/info/funding-tenders/opportunities/portal/screen/opportunities/topic-details/CREA-MEDIA-2026-TVONLINE-1"
"TV and online content Fiction projects","https://ec.europa.eu/info/funding-tenders/opportunities/portal/screen/opportunities/topic-details/CREA-MEDIA-2026-TVONLINE-3"
"TV and online content Documentary projects","https://ec.europa.eu/info/funding-tenders/opportunities/portal/screen/opportunities/topic-details/CREA-MEDIA-2026-TVONLINE-2"
"Video games and immersive content development","https://ec.europa.eu/info/funding-tenders/opportunities/portal/screen/opportunities/topic-details/CREA-MEDIA-2026-DEVVGIM"
"European slate development","https://ec.europa.eu/info/funding-tenders/opportunities/portal/screen/opportunities/topic-details/CREA-MEDIA-2026-DEVSLATE"
"European co-development","https://ec.europa.eu/info/funding-tenders/opportunities/portal/screen/opportunities/topic-details/CREA-MEDIA-2026-CODEV"
"Predicting and avoiding road crashes based on Artificial Intelligence (AI) and big data","https://ec.europa.eu/info/funding-tenders/opportunities/portal/screen/opportunities/topic-details/HORIZON-CL5-2026-01-D6-14"
"Next-generation environment perception for real world CCAM operations: Error-free and secure technologies to improve energy-efficiency, cost-effectiveness, and circularity (CCAM Partnership)","https://ec.europa.eu/info/funding-tenders/opportunities/portal/screen/opportunities/topic-details/HORIZON-CL5-2026-01-D6-03"
"Accelerating freight transport and logistics digital innovation","https://ec.europa.eu/info/funding-tenders/opportunities/portal/screen/opportunities/topic-details/HORIZON-CL5-2026-01-D6-08"
"Development of sustainable and design-to-cost batteries with (energy-)efficient manufacturing processes and based on advanced and safer materials (Batt4EU Partnership)","https://ec.europa.eu/info/funding-tenders/opportunities/portal/screen/opportunities/topic-details/HORIZON-CL5-2026-01-D2-01"
"Safety of Cyclists, Pedestrians and Users of Micromobility Devices","https://ec.europa.eu/info/funding-tenders/opportunities/portal/screen/opportunities/topic-details/HORIZON-CL5-2026-01-D6-13"
"Integration of human driving behaviour in the validation of CCAM systems (CCAM Partnership)","https://ec.europa.eu/info/funding-tenders/opportunities/portal/screen/opportunities/topic-details/HORIZON-CL5-2026-01-D6-04"
"Innovative construction and maintenance, with the use of new materials and techniques, for resilient and sustainable transport infrastructure","https://ec.europa.eu/info/funding-tenders/opportunities/portal/screen/opportunities/topic-details/HORIZON-CL5-2026-01-D6-07"
"Integrating inland waterway transport in smart shipping and multimodal logistics chains","https://ec.europa.eu/info/funding-tenders/opportunities/portal/screen/opportunities/topic-details/HORIZON-CL5-2026-01-D6-10"
"Federated CCAM data exchange platform (CCAM Partnership)","https://ec.europa.eu/info/funding-tenders/opportunities/portal/screen/opportunities/topic-details/HORIZON-CL5-2026-01-D6-06"
"Accelerated multi-physical and virtual testing for battery aging, reliability, and safety evaluation (Batt4EU Partnership)","https://ec.europa.eu/info/funding-tenders/opportunities/portal/screen/opportunities/topic-details/HORIZON-CL5-2026-01-D2-05"
"Real time monitoring of regulated and non-regulated emissions from all types of vessels and other port activities in order to enforce emission limits in waterfront cities","https://ec.europa.eu/info/funding-tenders/opportunities/portal/screen/opportunities/topic-details/HORIZON-CL5-2026-01-D5-17"
"Approaches, verification and training for Edge-AI building blocks for CCAM Systems (CCAM Partnership)","https://ec.europa.eu/info/funding-tenders/opportunities/portal/screen/opportunities/topic-details/HORIZON-CL5-2026-01-D6-05"
"Reliable data and practices to measure and calculate transport emissions in multimodal transport chains","https://ec.europa.eu/info/funding-tenders/opportunities/portal/screen/opportunities/topic-details/HORIZON-CL5-2026-01-D6-09"
"Icing in the context of sustainable aviation","https://ec.europa.eu/info/funding-tenders/opportunities/portal/screen/opportunities/topic-details/HORIZON-CL5-2026-01-D6-15"
"Monitoring and Evaluation of the Societal Readiness Pilot","https://ec.europa.eu/info/funding-tenders/opportunities/portal/screen/opportunities/topic-details/HORIZON-CL5-2026-01-D2-09"
"Integrating advanced materials, cell design and manufacturing development for high-performance batteries aimed at mobility (Batt4EU Partnership)","https://ec.europa.eu/info/funding-tenders/opportunities/portal/screen/opportunities/topic-details/HORIZON-CL5-2026-01-D2-04"
"ERC CONSOLIDATOR GRANTS","https://ec.europa.eu/info/funding-tenders/opportunities/portal/screen/opportunities/topic-details/ERC-2026-COG"
"Call for proposals to support the development of a medicine pricing, reimbursement and access tracker through the EURIPID database","https://ec.europa.eu/info/funding-tenders/opportunities/portal/screen/opportunities/topic-details/EU4H-2026-SANTE-PJ-06"
"Call for proposals to pilot and implement cancer screening programmes for gastric cancer","https://ec.europa.eu/info/funding-tenders/opportunities/portal/screen/opportunities/topic-details/EU4H-2026-SANTE-PJ-01"
"Call for proposals to contribute to the organisation of conferences and events","https://ec.europa.eu/info/funding-tenders/opportunities/portal/screen/opportunities/topic-details/EU4H-2026-SANTE-PJ-09"
"A European flagship initiative leveraging AI and health data for cardiovascular health and related non-communicable diseases: Advancing Risk Prediction, Prevention, Treatments, Personalised Care and Rehabilitation","https://ec.europa.eu/info/funding-tenders/opportunities/portal/screen/opportunities/topic-details/EU4H-2026-SANTE-PJ-04"
"Call for proposals for health data for biotech innovation leveraging the European Health Data Space","https://ec.europa.eu/info/funding-tenders/opportunities/portal/screen/opportunities/topic-details/EU4H-2026-SANTE-PJ-08"
"Call for proposals to pilot and implement cancer screening programmes for prostate cancer","https://ec.europa.eu/info/funding-tenders/opportunities/portal/screen/opportunities/topic-details/EU4H-2026-SANTE-PJ-03"
"Call for proposals to pilot and implement cancer screening programmes for lung cancer","https://ec.europa.eu/info/funding-tenders/opportunities/portal/screen/opportunities/topic-details/EU4H-2026-SANTE-PJ-02"
"Call for proposals on lifelong prevention for a healthy life with focus on cardiovascular diseases","https://ec.europa.eu/info/funding-tenders/opportunities/portal/screen/opportunities/topic-details/EU4H-2026-SANTE-PJ-05"
"Call for proposals for a programme on orphan medical devices, in particular targeting paediatric patients","https://ec.europa.eu/info/funding-tenders/opportunities/portal/screen/opportunities/topic-details/EU4H-2026-SANTE-PJ-07"
"Phase out fossil fuel in energy intensive industries through the efficient integration of renewable energy sources","https://ec.europa.eu/info/funding-tenders/opportunities/portal/screen/opportunities/topic-details/HORIZON-CL5-2026-02-D4-06"
"On-site innovative robotic and automated solutions and techniques for more sustainable and less disruptive building renovation and construction","https://ec.europa.eu/info/funding-tenders/opportunities/portal/screen/opportunities/topic-details/HORIZON-CL5-2026-02-D4-01"
"Extending the lifetime of crystalline silicon PV modules (EUPI-PV Partnership)","https://ec.europa.eu/info/funding-tenders/opportunities/portal/screen/opportunities/topic-details/HORIZON-CL5-2026-02-D3-12"
"De-risking wave energy technology development through transnational pre-commercial procurement of wave energy research and development","https://ec.europa.eu/info/funding-tenders/opportunities/portal/screen/opportunities/topic-details/HORIZON-CL5-2026-02-D3-13"
"Innovative approaches for the deployment of Positive Energy Districts","https://ec.europa.eu/info/funding-tenders/opportunities/portal/screen/opportunities/topic-details/HORIZON-CL5-2026-02-D4-04"
"New CO2 capture technologies","https://ec.europa.eu/info/funding-tenders/opportunities/portal/screen/opportunities/topic-details/HORIZON-CL5-2026-02-D3-24"
"Underground Thermal Energy Storage in dense urban areas","https://ec.europa.eu/info/funding-tenders/opportunities/portal/screen/opportunities/topic-details/HORIZON-CL5-2026-02-D3-22"
"Demonstration of thermal energy storage solutions for solar thermal plants and systems","https://ec.europa.eu/info/funding-tenders/opportunities/portal/screen/opportunities/topic-details/HORIZON-CL5-2026-02-D3-05"
"Next generation distribution substation for increasing the system resilience","https://ec.europa.eu/info/funding-tenders/opportunities/portal/screen/opportunities/topic-details/HORIZON-CL5-2026-02-D3-18"
"Optimal combination of low embodied carbon construction products, technical building systems and circularity principles for climate neutral buildings (Built4People Partnership)","https://ec.europa.eu/info/funding-tenders/opportunities/portal/screen/opportunities/topic-details/HORIZON-CL5-2026-02-D4-05"
"Development of innovative solutions strengthening the security of renewable energy value chains","https://ec.europa.eu/info/funding-tenders/opportunities/portal/screen/opportunities/topic-details/HORIZON-CL5-2026-02-D3-14"
"Innovative pathways for low carbon and climate resilient building stock and built environment (Built4People Partnership)","https://ec.europa.eu/info/funding-tenders/opportunities/portal/screen/opportunities/topic-details/HORIZON-CL5-2026-02-D4-03"
"Improved reliability and optimised operations and maintenance for wind energy systems","https://ec.europa.eu/info/funding-tenders/opportunities/portal/screen/opportunities/topic-details/HORIZON-CL5-2026-02-D3-07"
"Towards commercialisation of Perovskite PV and development of dedicated manufacturing equipment (EUPI-PV Partnership)","https://ec.europa.eu/info/funding-tenders/opportunities/portal/screen/opportunities/topic-details/HORIZON-CL5-2026-02-D3-10"
"European network of national competence centers for innovation procurement","https://ec.europa.eu/info/funding-tenders/opportunities/portal/screen/opportunities/topic-details/HORIZON-EIE-2026-01-CONNECT-01"
"Expanding Investment Ecosystems","https://ec.europa.eu/info/funding-tenders/opportunities/portal/screen/opportunities/topic-details/HORIZON-EIE-2026-01-CONNECT-02"
"Scaling up deep tech ecosystems","https://ec.europa.eu/info/funding-tenders/opportunities/portal/screen/opportunities/topic-details/HORIZON-EIE-2026-01-CONNECT-03"
"Call for proposals to support the development of innovative medical countermeasures for chemical, biological, radiological and nuclear threats (HERA) - Reusable respiratory personal protective equipment (PPE)","https://ec.europa.eu/info/funding-tenders/opportunities/portal/screen/opportunities/topic-details/EU4H-2025-HERA-PJ-1-b"
"Call for proposals to support the development of innovative medical countermeasures for chemical, biological, radiological and nuclear threats (HERA) - Medicinal products","https://ec.europa.eu/info/funding-tenders/opportunities/portal/screen/opportunities/topic-details/EU4H-2025-HERA-PJ-1-a"
"Call for proposals for the development of new diagnostic tests for vector-borne diseases (HERA)","https://ec.europa.eu/info/funding-tenders/opportunities/portal/screen/opportunities/topic-details/EU4H-2025-HERA-PJ-2"
"Call for proposals to support the development of innovative medical countermeasures for chemical, biological, radiological and nuclear threats (HERA) - Detection and diagnosis","https://ec.europa.eu/info/funding-tenders/opportunities/portal/screen/opportunities/topic-details/EU4H-2025-HERA-PJ-1-c"
"Empowering Truck Drivers – Revolutionizing European Logistics","https://ec.europa.eu/info/funding-tenders/opportunities/portal/screen/opportunities/topic-details/PPPA-2025-EMPOWERTD"
"Setting up of Cross-Border Coordination Points","https://ec.europa.eu/info/funding-tenders/opportunities/portal/screen/opportunities/topic-details/PPPA-2025-BRIDGEFOREU"
"Support for the Ukrainian tech SMEs and startups","https://ec.europa.eu/info/funding-tenders/opportunities/portal/screen/opportunities/topic-details/HORIZON-EIC-2025-UKRAINIANTECH-01"
"Networking and coordination of national HPC Competence Centres","https://ec.europa.eu/info/funding-tenders/opportunities/portal/screen/opportunities/topic-details/DIGITAL-JU-EUROHPC-2025-NCC-01-02"
"National Competence Centres for High Performance Computing","https://ec.europa.eu/info/funding-tenders/opportunities/portal/screen/opportunities/topic-details/DIGITAL-JU-EUROHPC-2025-NCC-01-01"
"Waste-to-value devices - circular production of renewable fuels, chemicals and materials","https://ec.europa.eu/info/funding-tenders/opportunities/portal/screen/opportunities/topic-details/HORIZON-EIC-2025-PATHFINDERCHALLENGES-01-04"
"Towards autonomous robot collectives delivering collaborative tasks in dynamic unstructured construction environments","https://ec.europa.eu/info/funding-tenders/opportunities/portal/screen/opportunities/topic-details/HORIZON-EIC-2025-PATHFINDERCHALLENGES-01-03"
"Generative-AI based Agents to Revolutionize Medical Diagnosis and Treatment of Cancer","https://ec.europa.eu/info/funding-tenders/opportunities/portal/screen/opportunities/topic-details/HORIZON-EIC-2025-PATHFINDERCHALLENGES-01-02"
"Biotech for Climate Resilient Crops and Plant-Based Biomanufacturing","https://ec.europa.eu/info/funding-tenders/opportunities/portal/screen/opportunities/topic-details/HORIZON-EIC-2025-PATHFINDERCHALLENGES-01-01"
"Promoting diversity management and inclusion at the workplace, both in the public and private sector","https://ec.europa.eu/info/funding-tenders/opportunities/portal/screen/opportunities/topic-details/CERV-2025-EQUAL-DIVERSITYMGT"
"Fighting against antisemitism","https://ec.europa.eu/info/funding-tenders/opportunities/portal/screen/opportunities/topic-details/CERV-2025-EQUAL-ANTISEMITISM"
"Fighting discrimination against LGBTIQ people and promoting LGBTIQ equality","https://ec.europa.eu/info/funding-tenders/opportunities/portal/screen/opportunities/topic-details/CERV-2025-EQUAL-LGBTIQ"
"Fighting against discrimination and racism, xenophobia and other forms of intolerance, including antigypsyism, anti-black, and anti-Asian racism","https://ec.europa.eu/info/funding-tenders/opportunities/portal/screen/opportunities/topic-details/CERV-2025-EQUAL-RACI-DISC"
"Fighting against anti-Muslim hatred","https://ec.europa.eu/info/funding-tenders/opportunities/portal/screen/opportunities/topic-details/CERV-2025-EQUAL-ANTIMUSLIM"
"Support to public authorities to combat racism, xenophobia, LGBTIQ-phobia and all other forms of intolerance, including intersectional discrimination","https://ec.europa.eu/info/funding-tenders/opportunities/portal/screen/opportunities/topic-details/CERV-2025-EQUAL-RESTRICTED"
"Support standardisation for the EuroQCI (CSA)","https://ec.europa.eu/info/funding-tenders/opportunities/portal/screen/opportunities/topic-details/DIGITAL-IRIS2-2025-QCI-03"
"Coordinate deployment for the EuroQCI (CSA)","https://ec.europa.eu/info/funding-tenders/opportunities/portal/screen/opportunities/topic-details/DIGITAL-IRIS2-2025-QCI-02"
"Maturing of a European industrial ecosystem for security-certified terrestrial QKD technologies and systems","https://ec.europa.eu/info/funding-tenders/opportunities/portal/screen/opportunities/topic-details/DIGITAL-IRIS2-2025-QCI-01"
"ERC SYNERGY GRANTS","https://ec.europa.eu/info/funding-tenders/opportunities/portal/screen/opportunities/topic-details/ERC-2026-SyG"
"ERC STARTING GRANTS","https://ec.europa.eu/info/funding-tenders/opportunities/portal/screen/opportunities/topic-details/ERC-2026-STG"
"Lot1: Improved methods for chemical and biological monitoring data collection and reporting in collaboration with AGoD and EFSA programs","https://ec.europa.eu/info/funding-tenders/opportunities/portal/screen/opportunities/topic-details/EUBA-EFSA-2025-IDATA-01-01-Lot1"
"Lot2: Harmonized food consumption and food composition data collection - Support to terminology management","https://ec.europa.eu/info/funding-tenders/opportunities/portal/screen/opportunities/topic-details/EUBA-EFSA-2025-IDATA-01-02-Lot2"
"DIGITAL-JU-CHIPS-2025-SG-SSOI","https://ec.europa.eu/info/funding-tenders/opportunities/portal/screen/opportunities/topic-details/DIGITAL-JU-CHIPS-2025-SG-SSOI"
"Support to the International HPC Summer School","https://ec.europa.eu/info/funding-tenders/opportunities/portal/screen/opportunities/topic-details/HORIZON-EUROHPC-JU-2025-IHPCSS-02"
"Operational digital platforms – Works","https://ec.europa.eu/info/funding-tenders/opportunities/portal/screen/opportunities/topic-details/CEF-DIG-2025-PLATFORMS-WORKS"
"European Researchers' Night and Researchers at Schools 2026-2027","https://ec.europa.eu/info/funding-tenders/opportunities/portal/screen/opportunities/topic-details/HORIZON-MSCA-2025-CITIZENS-01-01"
"Welfare monitoring: data driven risk assessment in fast and slower growing broilers (BROWARD)","https://ec.europa.eu/info/funding-tenders/opportunities/portal/screen/opportunities/topic-details/EUBA-EFSA-2025-BIOHAW-01"
"Establishing Ortho and Cardiology Ambulatory Surgical Centres in Europe","https://ec.europa.eu/info/funding-tenders/opportunities/portal/screen/opportunities/topic-details/HORIZON-JU-IHI-2025-11-05-two-stage"
"Understanding how infections foster and induce non-communicable diseases","https://ec.europa.eu/info/funding-tenders/opportunities/portal/screen/opportunities/topic-details/HORIZON-JU-IHI-2025-11-02-two-stage"
"Leveraging Europe's Expertise to accelerate Cell Therapy for Type 1 Diabetes","https://ec.europa.eu/info/funding-tenders/opportunities/portal/screen/opportunities/topic-details/HORIZON-JU-IHI-2025-11-04-two-stage"
"AI-Powered Signal Detection in Pharmacovigilance","https://ec.europa.eu/info/funding-tenders/opportunities/portal/screen/opportunities/topic-details/HORIZON-JU-IHI-2025-11-03-two-stage"
"Towards precision medicine: platform for transdiagnostic stratification of brain dysfunction","https://ec.europa.eu/info/funding-tenders/opportunities/portal/screen/opportunities/topic-details/HORIZON-JU-IHI-2025-11-01-two-stage"
