identifier,title,status,plannedOpeningDate,firstDeadline,allDeadlines,destination,workProgrammePart,typeOfAction,typeOfMGAs,submissionSystem,url
"HORIZON-EUSPA-2026-SPACE-02-52","Innovative space-based applications enhancing capabilities for a resilient Europe","","","","","","","","","","https://ec.europa.eu/info/funding-tenders/opportunities/portal/screen/opportunities/topic-details/HORIZON-EUSPA-2026-SPACE-02-52"
"HORIZON-EUSPA-2026-SPACE-02-51","Space Data Economy","","","","","","","","","","https://ec.europa.eu/info/funding-tenders/opportunities/portal/screen/opportunities/topic-details/HORIZON-EUSPA-2026-SPACE-02-51"
"HORIZON-MSCA-2025-COFUND-02-01","MSCA Choose Europe for Science 2025","","","","","","","","","","https://ec.europa.eu/info/funding-tenders/opportunities/portal/screen/opportunities/topic-details/HORIZON-MSCA-2025-COFUND-02-01"
"PPPA-2025-DISINFORMATION-YOUNG","Building a trustworthy social media sphere: countering disinformation on social media  for young Europeans","","","","","","","","","","https://ec.europa.eu/info/funding-tenders/opportunities/portal/screen/opportunities/topic-details/PPPA-2025-DISINFORMATION-YOUNG"
"HORIZON-CL5-2026-02-D4-01","On-site innovative robotic and automated solutions and techniques for more sustainable and less disruptive building renovation and construction","","","","","","","","","","https://ec.europa.eu/info/funding-tenders/opportunities/portal/screen/opportunities/topic-details/HORIZON-CL5-2026-02-D4-01"
"HORIZON-CL5-2026-02-D3-18","Next generation distribution substation for increasing the system resilience","","","","","","","","","","https://ec.europa.eu/info/funding-tenders/opportunities/portal/screen/opportunities/topic-details/HORIZON-CL5-2026-02-D3-18"
"HORIZON-CL5-2026-02-D3-19","Innovative solutions for a generative AI-powered digital spine of the EU energy system","","","","","","","","","","https://ec.europa.eu/info/funding-tenders/opportunities/portal/screen/opportunities/topic-details/HORIZON-CL5-2026-02-D3-19"
"HORIZON-CL5-2026-02-D3-20","Innovative tools and services to manage and empower energy communities","","","","","","","","","","https://ec.europa.eu/info/funding-tenders/opportunities/portal/screen/opportunities/topic-details/HORIZON-CL5-2026-02-D3-20"
"HORIZON-CL5-2026-02-D3-13","De-risking wave energy technology development through transnational pre-commercial procurement of wave energy research and development","","","","","","","","","","https://ec.europa.eu/info/funding-tenders/opportunities/portal/screen/opportunities/topic-details/HORIZON-CL5-2026-02-D3-13"
"HORIZON-CL5-2026-02-D3-14","Development of innovative solutions strengthening the security of renewable energy value chains","","","","","","","","","","https://ec.europa.eu/info/funding-tenders/opportunities/portal/screen/opportunities/topic-details/HORIZON-CL5-2026-02-D3-14"
"HORIZON-CL5-2026-02-D3-24","New CO2 capture technologies","","","","","","","","","","https://ec.europa.eu/info/funding-tenders/opportunities/portal/screen/opportunities/topic-details/HORIZON-CL5-2026-02-D3-24"
"HORIZON-CL5-2026-02-D3-10","Towards commercialisation of Perovskite PV and development of dedicated manufacturing equipment (EUPI-PV Partnership)","","","","","","","","","","https://ec.europa.eu/info/funding-tenders/opportunities/portal/screen/opportunities/topic-details/HORIZON-CL5-2026-02-D3-10"
"HORIZON-CL5-2026-02-D4-06","Phase out fossil fuel in energy intensive industries through the efficient integration of renewable energy sources","","","","","","","","","","https://ec.europa.eu/info/funding-tenders/opportunities/portal/screen/opportunities/topic-details/HORIZON-CL5-2026-02-D4-06"
"HORIZON-CL5-2026-02-D4-05","Optimal combination of low embodied carbon construction products, technical building systems and circularity principles for climate neutral buildings (Built4People Partnership)","","","","","","","","","","https://ec.europa.eu/info/funding-tenders/opportunities/portal/screen/opportunities/topic-details/HORIZON-CL5-2026-02-D4-05"
"HORIZON-CL5-2026-02-D4-04","Innovative approaches for the deployment of Positive Energy Districts","","","","","","","","","","https://ec.europa.eu/info/funding-tenders/opportunities/portal/screen/opportunities/topic-details/HORIZON-CL5-2026-02-D4-04"
"HORIZON-CL5-2026-02-D3-05","Demonstration of thermal energy storage solutions for solar thermal plants and systems","","","","","","","","","","https://ec.europa.eu/info/funding-tenders/opportunities/portal/screen/opportunities/topic-details/HORIZON-CL5-2026-02-D3-05"
"HORIZON-CL5-2026-02-D3-12","Extending the lifetime of crystalline silicon PV modules (EUPI-PV Partnership)","","","","","","","","","","https://ec.europa.eu/info/funding-tenders/opportunities/portal/screen/opportunities/topic-details/HORIZON-CL5-2026-02-D3-12"
"HORIZON-CL5-2026-02-D3-08","Understand and minimise the environmental impacts of offshore wind energy","","","","","","","","","","https://ec.europa.eu/info/funding-tenders/opportunities/portal/screen/opportunities/topic-details/HORIZON-CL5-2026-02-D3-08"
"HORIZON-CL5-2026-02-D3-22","Underground Thermal Energy Storage in dense urban areas","","","","","","","","","","https://ec.europa.eu/info/funding-tenders/opportunities/portal/screen/opportunities/topic-details/HORIZON-CL5-2026-02-D3-22"
"HORIZON-CL5-2026-02-D3-02","Competitiveness, energy security and integration aspects of advanced biofuels and renewable fuels of non-biological origin value chains","","","","","","","","","","https://ec.europa.eu/info/funding-tenders/opportunities/portal/screen/opportunities/topic-details/HORIZON-CL5-2026-02-D3-02"
"HORIZON-CL5-2026-02-D3-01","Large-scale production of liquid advanced biofuels and renewable fuels of non-biological origin","","","","","","","","","","https://ec.europa.eu/info/funding-tenders/opportunities/portal/screen/opportunities/topic-details/HORIZON-CL5-2026-02-D3-01"
"HORIZON-CL5-2026-02-D4-02","Smarter buildings as part of the energy system for increased efficiency and flexibility – Societal Readiness Pilot","","","","","","","","","","https://ec.europa.eu/info/funding-tenders/opportunities/portal/screen/opportunities/topic-details/HORIZON-CL5-2026-02-D4-02"
"HORIZON-CL5-2026-02-D4-03","Innovative pathways for low carbon and climate resilient building stock and built environment (Built4People Partnership)","","","","","","","","","","https://ec.europa.eu/info/funding-tenders/opportunities/portal/screen/opportunities/topic-details/HORIZON-CL5-2026-02-D4-03"
"HORIZON-CL5-2026-01-D6-13","Safety of Cyclists, Pedestrians and Users of Micromobility Devices","","","","","","","","","","https://ec.europa.eu/info/funding-tenders/opportunities/portal/screen/opportunities/topic-details/HORIZON-CL5-2026-01-D6-13"
"HORIZON-CL5-2026-01-D6-07","Innovative construction and maintenance, with the use of new materials and techniques, for resilient and sustainable transport infrastructure","","","","","","","","","","https://ec.europa.eu/info/funding-tenders/opportunities/portal/screen/opportunities/topic-details/HORIZON-CL5-2026-01-D6-07"
"HORIZON-CL5-2026-01-D2-01","Development of sustainable and design-to-cost batteries with (energy-)efficient manufacturing processes and based on advanced and safer materials (Batt4EU Partnership)","","","","","","","","","","https://ec.europa.eu/info/funding-tenders/opportunities/portal/screen/opportunities/topic-details/HORIZON-CL5-2026-01-D2-01"
"HORIZON-CL5-2026-01-D5-17","Real time monitoring of regulated and non-regulated emissions from all types of vessels and other port activities in order to enforce emission limits in waterfront cities","","","","","","","","","","https://ec.europa.eu/info/funding-tenders/opportunities/portal/screen/opportunities/topic-details/HORIZON-CL5-2026-01-D5-17"
"HORIZON-CL5-2026-01-D6-05","Approaches, verification and training for Edge-AI building blocks for CCAM Systems (CCAM Partnership)","","","","","","","","","","https://ec.europa.eu/info/funding-tenders/opportunities/portal/screen/opportunities/topic-details/HORIZON-CL5-2026-01-D6-05"
"HORIZON-CL5-2026-01-D6-08","Accelerating freight transport and logistics digital innovation","","","","","","","","","","https://ec.europa.eu/info/funding-tenders/opportunities/portal/screen/opportunities/topic-details/HORIZON-CL5-2026-01-D6-08"
"HORIZON-CL5-2026-01-D6-04","Integration of human driving behaviour in the validation of CCAM systems (CCAM Partnership)","","","","","","","","","","https://ec.europa.eu/info/funding-tenders/opportunities/portal/screen/opportunities/topic-details/HORIZON-CL5-2026-01-D6-04"
"HORIZON-CL5-2026-01-D2-04","Integrating advanced materials, cell design and manufacturing development for high-performance batteries aimed at mobility (Batt4EU Partnership)","","","","","","","","","","https://ec.europa.eu/info/funding-tenders/opportunities/portal/screen/opportunities/topic-details/HORIZON-CL5-2026-01-D2-04"
"HORIZON-CL5-2026-01-D6-14","Predicting and avoiding road crashes based on Artificial Intelligence (AI) and big data","","","","","","","","","","https://ec.europa.eu/info/funding-tenders/opportunities/portal/screen/opportunities/topic-details/HORIZON-CL5-2026-01-D6-14"
"HORIZON-CL5-2026-01-D2-09","Monitoring and Evaluation of the Societal Readiness Pilot","","","","","","","","","","https://ec.europa.eu/info/funding-tenders/opportunities/portal/screen/opportunities/topic-details/HORIZON-CL5-2026-01-D2-09"
"HORIZON-CL5-2026-01-D6-10","Integrating inland waterway transport in smart shipping and multimodal logistics chains","","","","","","","","","","https://ec.europa.eu/info/funding-tenders/opportunities/portal/screen/opportunities/topic-details/HORIZON-CL5-2026-01-D6-10"
"HORIZON-CL5-2026-01-D6-15","Icing in the context of sustainable aviation","","","","","","","","","","https://ec.europa.eu/info/funding-tenders/opportunities/portal/screen/opportunities/topic-details/HORIZON-CL5-2026-01-D6-15"
"HORIZON-CL5-2026-01-D6-03","Next-generation environment perception for real world CCAM operations: Error-free and secure technologies to improve energy-efficiency, cost-effectiveness, and circularity (CCAM Partnership)","","","","","","","","","","https://ec.europa.eu/info/funding-tenders/opportunities/portal/screen/opportunities/topic-details/HORIZON-CL5-2026-01-D6-03"
"HORIZON-CL5-2026-01-D6-09","Reliable data and practices to measure and calculate transport emissions in multimodal transport chains","","","","","","","","","","https://ec.europa.eu/info/funding-tenders/opportunities/portal/screen/opportunities/topic-details/HORIZON-CL5-2026-01-D6-09"
"HORIZON-CL5-2026-01-D2-05","Accelerated multi-physical and virtual testing for battery aging, reliability, and safety evaluation (Batt4EU Partnership)","","","","","","","","","","https://ec.europa.eu/info/funding-tenders/opportunities/portal/screen/opportunities/topic-details/HORIZON-CL5-2026-01-D2-05"
"HORIZON-CL5-2026-01-D6-06","Federated CCAM data exchange platform (CCAM Partnership)","","","","","","","","","","https://ec.europa.eu/info/funding-tenders/opportunities/portal/screen/opportunities/topic-details/HORIZON-CL5-2026-01-D6-06"
"HORIZON-CL5-2026-02-D3-07","Improved reliability and optimised operations and maintenance for wind energy systems","","","","","","","","","","https://ec.europa.eu/info/funding-tenders/opportunities/portal/screen/opportunities/topic-details/HORIZON-CL5-2026-02-D3-07"
"HORIZON-EIE-2026-01-CONNECT-03","Scaling up deep tech ecosystems","","","","","","","","","","https://ec.europa.eu/info/funding-tenders/opportunities/portal/screen/opportunities/topic-details/HORIZON-EIE-2026-01-CONNECT-03"
"HORIZON-EIE-2026-01-CONNECT-01","European network of national competence centers for innovation procurement","","","","","","","","","","https://ec.europa.eu/info/funding-tenders/opportunities/portal/screen/opportunities/topic-details/HORIZON-EIE-2026-01-CONNECT-01"
"HORIZON-EIE-2026-01-CONNECT-02","Expanding Investment Ecosystems","","","","","","","","","","https://ec.europa.eu/info/funding-tenders/opportunities/portal/screen/opportunities/topic-details/HORIZON-EIE-2026-01-CONNECT-02"